bill_id,session_id,bill_number,status,status_desc,status_date,title,description,committee_id,committee,last_action_date,last_action,url,state_link
907915,1414,HB4001,1,Introduced,2017-01-11,"Individual income tax; rate; annual rollback of rate until zero; provide for. Amends sec. 51 of 1967 PA 281 (MCL 206.51).","Individual income tax; rate; annual rollback of rate until zero; provide for. Amends sec. 51 of 1967 PA 281 (MCL 206.51).",0,,2017-02-23,"Postponed For The Day",https://legiscan.com/MI/bill/HB4001/2017,http://legislature.mi.gov/doc.aspx?2017-HB-4001
907561,1414,HB4002,1,Introduced,2017-01-11,"Local government; other; publication of legal notices; revise, and create the local government public notice act. Creates new act.","Local government; other; publication of legal notices; revise, and create the local government public notice act. Creates new act.",0,,2017-01-12,"Bill Electronically Reproduced 01/11/2017",https://legiscan.com/MI/bill/HB4002/2017,http://legislature.mi.gov/doc.aspx?2017-HB-4002
907589,1414,HB4003,1,Introduced,2017-01-11,"Weapons; concealed; permit requirement to carry and transport a concealed pistol; eliminate for certain individuals. Amends sec. 12a of 1927 PA 372 (MCL 28.432a).","Weapons; concealed; permit requirement to carry and transport a concealed pistol; eliminate for certain individuals. Amends sec. 12a of 1927 PA 372 (MCL 28.432a).",0,,2017-01-12,"Bill Electronically Reproduced 01/11/2017",https://legiscan.com/MI/bill/HB4003/2017,http://legislature.mi.gov/doc.aspx?2017-HB-4003
908086,1414,HB4004,1,Introduced,2017-01-11,"Weapons; firearms; 1927 PA 372; update references. Amends secs. 12 & 15 of 1927 PA 372 (MCL 28.432 & 28.435). TIE BAR WITH: HB 4005'17","Weapons; firearms; 1927 PA 372; update references. Amends secs. 12 & 15 of 1927 PA 372 (MCL 28.432 & 28.435). TIE BAR WITH: HB 4005'17",0,,2017-01-12,"Bill Electronically Reproduced 01/11/2017",https://legiscan.com/MI/bill/HB4004/2017,http://legislature.mi.gov/doc.aspx?2017-HB-4004
907490,1414,HB4005,1,Introduced,2017-01-11,"Crimes; weapons; transportation and possession of a firearm; allow for certain individuals. Amends secs. 227 & 230 of 1931 PA 328 (MCL 750.227 & 750.230) & repeals sec. 231a of 1931 PA 328 (MCL 750.231a).","Crimes; weapons; transportation and possession of a firearm; allow for certain individuals. Amends secs. 227 & 230 of 1931 PA 328 (MCL 750.227 & 750.230) & repeals sec. 231a of 1931 PA 328 (MCL 750.231a).",0,,2017-01-12,"Bill Electronically Reproduced 01/11/2017",https://legiscan.com/MI/bill/HB4005/2017,http://legislature.mi.gov/doc.aspx?2017-HB-4005
907526,1414,HB4006,1,Introduced,2017-01-11,"Weapons; firearms; natural resources and environmental protection act; update references. Amends sec. 43510 of 1994 PA 451 (MCL 324.43510). TIE BAR WITH: HB 4005'17","Weapons; firearms; natural resources and environmental protection act; update references. Amends sec. 43510 of 1994 PA 451 (MCL 324.43510). TIE BAR WITH: HB 4005'17",0,,2017-01-12,"Bill Electronically Reproduced 01/11/2017",https://legiscan.com/MI/bill/HB4006/2017,http://legislature.mi.gov/doc.aspx?2017-HB-4006
907980,1414,HB4007,1,Introduced,2017-01-11,"Natural resources; gas and oil; setback for gas wells near certain residential areas; modify under certain circumstances. Amends sec. 61506b of 1994 PA 451 (MCL 324.61506b).","Natural resources; gas and oil; setback for gas wells near certain residential areas; modify under certain circumstances. Amends sec. 61506b of 1994 PA 451 (MCL 324.61506b).",0,,2017-01-12,"Bill Electronically Reproduced 01/11/2017",https://legiscan.com/MI/bill/HB4007/2017,http://legislature.mi.gov/doc.aspx?2017-HB-4007
907458,1414,HB4008,1,Introduced,2017-01-11,"Natural resources; gas and oil; drilling impact study; establish, and allocate funding. Amends 1994 PA 451 (MCL 324.101 - 324.90106) by adding sec. 61506d.","Natural resources; gas and oil; drilling impact study; establish, and allocate funding. Amends 1994 PA 451 (MCL 324.101 - 324.90106) by adding sec. 61506d.",0,,2017-01-12,"Bill Electronically Reproduced 01/11/2017",https://legiscan.com/MI/bill/HB4008/2017,http://legislature.mi.gov/doc.aspx?2017-HB-4008
908019,1414,HB4009,1,Introduced,2017-01-11,"Children; child care; child care database; modify. Amends secs. 3 & 11b of 1973 PA 116 (MCL 722.113 & 722.121b).","Children; child care; child care database; modify. Amends secs. 3 & 11b of 1973 PA 116 (MCL 722.113 & 722.121b).",0,,2017-01-12,"Bill Electronically Reproduced 01/11/2017",https://legiscan.com/MI/bill/HB4009/2017,http://legislature.mi.gov/doc.aspx?2017-HB-4009
907744,1414,HB4010,1,Introduced,2017-01-11,"Traffic control; violations; notification to law enforcement information network (LEIN) of expired, terminated, or canceled automobile insurance; require of secretary of state and make other revisions. Amends secs. 227a, 255, 328 & 907 of 1949 PA 300 (MCL 257.227a et seq.). TIE BAR WITH: HB 4013'17","Traffic control; violations; notification to law enforcement information network (LEIN) of expired, terminated, or canceled automobile insurance; require of secretary of state and make other revisions. Amends secs. 227a, 255, 328 & 907 of 1949 PA 300 (MCL 257.227a et seq.). TIE BAR WITH: HB 4013'17",0,,2017-01-12,"Bill Electronically Reproduced 01/11/2017",https://legiscan.com/MI/bill/HB4010/2017,http://legislature.mi.gov/doc.aspx?2017-HB-4010
907880,1414,HB4011,1,Introduced,2017-01-11,"State; other; establishment of eastern daylight time as the time zone for the state; provide for. Creates new act.","State; other; establishment of eastern daylight time as the time zone for the state; provide for. Creates new act.",0,,2017-01-12,"Bill Electronically Reproduced 01/11/2017",https://legiscan.com/MI/bill/HB4011/2017,http://legislature.mi.gov/doc.aspx?2017-HB-4011
907778,1414,HB4012,1,Introduced,2017-01-11,"Criminal procedure; evidence; evidence obtained in violation of reasonable or probable cause requirements for issuance of a search warrant; allow to be used to revoke parole or probation or impeach a defendant's testimony. Amends sec. 3 of 1966 PA 189 (MCL 780.653).","Criminal procedure; evidence; evidence obtained in violation of reasonable or probable cause requirements for issuance of a search warrant; allow to be used to revoke parole or probation or impeach a defendant's testimony. Amends sec. 3 of 1966 PA 189 (MCL 780.653).",0,,2017-01-12,"Bill Electronically Reproduced 01/11/2017",https://legiscan.com/MI/bill/HB4012/2017,http://legislature.mi.gov/doc.aspx?2017-HB-4012
907655,1414,HB4013,4,Passed,2017-07-12,"Vehicles; registration; paperless registration; allow. Amends sec. 223 of 1949 PA 300 (MCL 257.223).","Vehicles; registration; paperless registration; allow. Amends sec. 223 of 1949 PA 300 (MCL 257.223).",0,,2017-07-12,"Assigned Pa 59'17 With Immediate Effect",https://legiscan.com/MI/bill/HB4013/2017,http://legislature.mi.gov/doc.aspx?2017-HB-4013
908053,1414,HB4014,1,Introduced,2017-01-11,"Individual income tax; credit; credit for pay-to-play fees for students to participate in extracurricular activities at school; provide for. Amends 1967 PA 281 (MCL 206.1 - 206.713) by adding sec. 254.","Individual income tax; credit; credit for pay-to-play fees for students to participate in extracurricular activities at school; provide for. Amends 1967 PA 281 (MCL 206.1 - 206.713) by adding sec. 254.",0,,2017-01-12,"Bill Electronically Reproduced 01/11/2017",https://legiscan.com/MI/bill/HB4014/2017,http://legislature.mi.gov/doc.aspx?2017-HB-4014
907948,1414,HB4015,1,Introduced,2017-01-11,"Housing; condominium; co-owner approval of budgets; provide for, and require LARA to provide investigative, enforcement, and dispute resolution services in conflicts between a co-owner and an association. Amends sec. 107 of 1978 PA 59 (MCL 559.207); adds sec. 70 & repeals sec. 139 of 1978 PA 59 (MCL 559.239).","Housing; condominium; co-owner approval of budgets; provide for, and require LARA to provide investigative, enforcement, and dispute resolution services in conflicts between a co-owner and an association. Amends sec. 107 of 1978 PA 59 (MCL 559.207); adds sec. 70 & repeals sec. 139 of 1978 PA 59 (MCL 559.239).",0,,2017-01-12,"Bill Electronically Reproduced 01/11/2017",https://legiscan.com/MI/bill/HB4015/2017,http://legislature.mi.gov/doc.aspx?2017-HB-4015
908115,1414,HB4016,1,Introduced,2017-01-11,"State agencies (proposed); boards and commissions; Michigan infrastructure council; establish. Creates new act.","State agencies (proposed); boards and commissions; Michigan infrastructure council; establish. Creates new act.",0,,2017-01-12,"Bill Electronically Reproduced 01/11/2017",https://legiscan.com/MI/bill/HB4016/2017,http://legislature.mi.gov/doc.aspx?2017-HB-4016
910257,1414,HB4017,1,Introduced,2017-01-12,"State financing and management; budget; disclosure of payments to local units of government; require. Amends sec. 492 of 1984 PA 431 (MCL 18.1492).","State financing and management; budget; disclosure of payments to local units of government; require. Amends sec. 492 of 1984 PA 431 (MCL 18.1492).",0,,2017-01-18,"Bill Electronically Reproduced 01/12/2017",https://legiscan.com/MI/bill/HB4017/2017,http://legislature.mi.gov/doc.aspx?2017-HB-4017
909987,1414,HB4018,1,Introduced,2017-01-12,"State financing and management; purchasing; preprivatization cost-benefit analysis and process for public service workers to present alternative recommendations; provide for. Amends 1984 PA 431 (MCL 18.1101 - 18.1594) by adding sec. 280.","State financing and management; purchasing; preprivatization cost-benefit analysis and process for public service workers to present alternative recommendations; provide for. Amends 1984 PA 431 (MCL 18.1101 - 18.1594) by adding sec. 280.",0,,2017-01-18,"Bill Electronically Reproduced 01/12/2017",https://legiscan.com/MI/bill/HB4018/2017,http://legislature.mi.gov/doc.aspx?2017-HB-4018
910456,1414,HB4019,1,Introduced,2017-01-12,"Insurance; health insurers; reimbursement for dispensing of a 365-day supply of covered prescription contraception; require. Amends 1956 PA 218 (MCL 500.100 - 500.8302) by adding sec. 3406u.","Insurance; health insurers; reimbursement for dispensing of a 365-day supply of covered prescription contraception; require. Amends 1956 PA 218 (MCL 500.100 - 500.8302) by adding sec. 3406u.",0,,2017-01-18,"Bill Electronically Reproduced 01/12/2017",https://legiscan.com/MI/bill/HB4019/2017,http://legislature.mi.gov/doc.aspx?2017-HB-4019
910122,1414,HB4020,1,Introduced,2017-01-12,"Children; protection; mandatory reporting requirements for child abuse or child neglect; expand to include K-12 coaches and volunteers. Amends sec. 3 of 1975 PA 238 (MCL 722.623).","Children; protection; mandatory reporting requirements for child abuse or child neglect; expand to include K-12 coaches and volunteers. Amends sec. 3 of 1975 PA 238 (MCL 722.623).",0,,2018-03-15,"Recommendation Concurred In",https://legiscan.com/MI/bill/HB4020/2017,http://legislature.mi.gov/doc.aspx?2017-HB-4020
910156,1414,HB4021,1,Introduced,2017-01-12,"Probate; guardians and conservators; guardianship petitions; allow probate judges to schedule certain hearings before minor turns 18 years of age. Amends secs. 5303 & 5306 of 1998 PA 386 (MCL 700.5303 & 700.5306).","Probate; guardians and conservators; guardianship petitions; allow probate judges to schedule certain hearings before minor turns 18 years of age. Amends secs. 5303 & 5306 of 1998 PA 386 (MCL 700.5303 & 700.5306).",0,,2017-01-18,"Bill Electronically Reproduced 01/12/2017",https://legiscan.com/MI/bill/HB4021/2017,http://legislature.mi.gov/doc.aspx?2017-HB-4021
909889,1414,HB4022,1,Introduced,2017-01-12,"Revenue sharing; cities and villages; increased revenue sharing payments for cities, villages, townships, and counties that participate in an incentive program; provide for. Amends 1971 PA 140 (MCL 141.901 - 141.921) by adding sec. 915.","Revenue sharing; cities and villages; increased revenue sharing payments for cities, villages, townships, and counties that participate in an incentive program; provide for. Amends 1971 PA 140 (MCL 141.901 - 141.921) by adding sec. 915.",0,,2017-01-18,"Bill Electronically Reproduced 01/12/2017",https://legiscan.com/MI/bill/HB4022/2017,http://legislature.mi.gov/doc.aspx?2017-HB-4022
910421,1414,HB4023,1,Introduced,2017-01-12,"Law enforcement; other; task force to review school policies and recommend improvements to policy and response efforts to school shootings; create. Creates new act.","Law enforcement; other; task force to review school policies and recommend improvements to policy and response efforts to school shootings; create. Creates new act.",0,,2017-01-18,"Bill Electronically Reproduced 01/12/2017",https://legiscan.com/MI/bill/HB4023/2017,http://legislature.mi.gov/doc.aspx?2017-HB-4023
909921,1414,HB4024,1,Introduced,2017-01-12,"Traffic control; driver license; renewal of driver license; extend to 8 years. Amends secs. 307 & 314 of 1949 PA 300 (MCL 257.307 & 257.314).","Traffic control; driver license; renewal of driver license; extend to 8 years. Amends secs. 307 & 314 of 1949 PA 300 (MCL 257.307 & 257.314).",0,,2017-01-18,"Bill Electronically Reproduced 01/12/2017",https://legiscan.com/MI/bill/HB4024/2017,http://legislature.mi.gov/doc.aspx?2017-HB-4024
909793,1414,HB4025,1,Introduced,2017-01-12,"Crimes; animals; penalties for person engaged in cruel treatment of companion animal in presence of a child; provide for. Amends sec. 50 of 1931 PA 328 (MCL 750.50).","Crimes; animals; penalties for person engaged in cruel treatment of companion animal in presence of a child; provide for. Amends sec. 50 of 1931 PA 328 (MCL 750.50).",0,,2017-01-18,"Bill Electronically Reproduced 01/12/2017",https://legiscan.com/MI/bill/HB4025/2017,http://legislature.mi.gov/doc.aspx?2017-HB-4025
910325,1414,HB4026,1,Introduced,2017-01-12,"Crimes; domestic violence; animal abuse crimes; include in definition of domestic violence under certain circumstances. Amends secs. 1 & 7 of 1978 PA 389 (MCL 400.1501 & 400.1507).","Crimes; domestic violence; animal abuse crimes; include in definition of domestic violence under certain circumstances. Amends secs. 1 & 7 of 1978 PA 389 (MCL 400.1501 & 400.1507).",0,,2017-01-18,"Bill Electronically Reproduced 01/12/2017",https://legiscan.com/MI/bill/HB4026/2017,http://legislature.mi.gov/doc.aspx?2017-HB-4026
909825,1414,HB4027,1,Introduced,2017-01-12,"Civil rights; open meetings; school board preventive security planning; provide exemption in open meetings act. Amends sec. 8 of 1976 PA 267 (MCL 15.268).","Civil rights; open meetings; school board preventive security planning; provide exemption in open meetings act. Amends sec. 8 of 1976 PA 267 (MCL 15.268).",0,,2017-01-18,"Bill Electronically Reproduced 01/12/2017",https://legiscan.com/MI/bill/HB4027/2017,http://legislature.mi.gov/doc.aspx?2017-HB-4027
909857,1414,HB4028,1,Introduced,2017-01-12,"Sales tax; collections; sales tax on higher education books; exempt. Amends sec. 4a of 1933 PA 167 (MCL 205.54a).","Sales tax; collections; sales tax on higher education books; exempt. Amends sec. 4a of 1933 PA 167 (MCL 205.54a).",0,,2017-01-18,"Bill Electronically Reproduced 01/12/2017",https://legiscan.com/MI/bill/HB4028/2017,http://legislature.mi.gov/doc.aspx?2017-HB-4028
910191,1414,HB4029,1,Introduced,2017-01-12,"State financing and management; other; state to collect city income tax for local municipalities; clarify enforcement. Amends sec. 13 of 1941 PA 122 (MCL 205.13).","State financing and management; other; state to collect city income tax for local municipalities; clarify enforcement. Amends sec. 13 of 1941 PA 122 (MCL 205.13).",0,,2017-01-18,"Bill Electronically Reproduced 01/12/2017",https://legiscan.com/MI/bill/HB4029/2017,http://legislature.mi.gov/doc.aspx?2017-HB-4029
910087,1414,HB4030,4,Passed,2018-08-15,"Individual income tax; checkoff; donation to the Lions of Michigan Foundation; provide for. Amends sec. 435 of 1967 PA 281 (MCL 206.435). TIE BAR WITH: HB 4031'17","Individual income tax; checkoff; donation to the Lions of Michigan Foundation; provide for. Amends sec. 435 of 1967 PA 281 (MCL 206.435). TIE BAR WITH: HB 4031'17",0,,2018-08-15,"Assigned Pa 254'18 With Immediate Effect",https://legiscan.com/MI/bill/HB4030/2017,http://legislature.mi.gov/doc.aspx?2017-HB-4030
910056,1414,HB4031,4,Passed,2018-08-15,"Individual income tax; other; Lions of Michigan Foundation fund act; create. Creates new act. TIE BAR WITH: HB 4030'17","Individual income tax; other; Lions of Michigan Foundation fund act; create. Creates new act. TIE BAR WITH: HB 4030'17",0,,2018-08-15,"Assigned Pa 255'18 With Immediate Effect",https://legiscan.com/MI/bill/HB4031/2017,http://legislature.mi.gov/doc.aspx?2017-HB-4031
910226,1414,HB4032,1,Introduced,2017-01-12,"Higher education; financial aid; number of governing bodies authorized to establish promise zones; increase. Amends sec. 4 of 2008 PA 549 (MCL 390.1664).","Higher education; financial aid; number of governing bodies authorized to establish promise zones; increase. Amends sec. 4 of 2008 PA 549 (MCL 390.1664).",0,,2017-01-18,"Bill Electronically Reproduced 01/12/2017",https://legiscan.com/MI/bill/HB4032/2017,http://legislature.mi.gov/doc.aspx?2017-HB-4032
910289,1414,HB4033,1,Introduced,2017-01-12,"Elections; absent voters; absent voter ballot; issue upon voter's request without requiring justification. Amends secs. 758, 759 & 759b of 1954 PA 116 (MCL 168.758 et seq.).","Elections; absent voters; absent voter ballot; issue upon voter's request without requiring justification. Amends secs. 758, 759 & 759b of 1954 PA 116 (MCL 168.758 et seq.).",0,,2017-01-18,"Bill Electronically Reproduced 01/12/2017",https://legiscan.com/MI/bill/HB4033/2017,http://legislature.mi.gov/doc.aspx?2017-HB-4033
910020,1414,HB4034,1,Introduced,2017-01-12,"Elections; absent voters; absent voter ballot; issue upon voter's request without requiring justification. Amends sec. 759 of 1954 PA 116 (MCL 168.759). TIE BAR WITH: HB 4033'17, HB 4035'17","Elections; absent voters; absent voter ballot; issue upon voter's request without requiring justification. Amends sec. 759 of 1954 PA 116 (MCL 168.759). TIE BAR WITH: HB 4033'17, HB 4035'17",0,,2017-01-18,"Bill Electronically Reproduced 01/12/2017",https://legiscan.com/MI/bill/HB4034/2017,http://legislature.mi.gov/doc.aspx?2017-HB-4034
910557,1414,HB4035,1,Introduced,2017-01-12,"Elections; absent voters; absent voter ballot; issue upon voter's request without requiring justification. Amends sec. 759b of 1954 PA 116 (MCL 168.759b). TIE BAR WITH: HB 4033'17, HB 4034'17","Elections; absent voters; absent voter ballot; issue upon voter's request without requiring justification. Amends sec. 759b of 1954 PA 116 (MCL 168.759b). TIE BAR WITH: HB 4033'17, HB 4034'17",0,,2017-01-18,"Bill Electronically Reproduced 01/12/2017",https://legiscan.com/MI/bill/HB4035/2017,http://legislature.mi.gov/doc.aspx?2017-HB-4035
910490,1414,HB4036,1,Introduced,2017-01-12,"Campaign finance; statements and reports; period when disclosure is required for issue ads; change. Amends sec. 47 of 1976 PA 388 (MCL 169.247).","Campaign finance; statements and reports; period when disclosure is required for issue ads; change. Amends sec. 47 of 1976 PA 388 (MCL 169.247).",0,,2017-01-18,"Bill Electronically Reproduced 01/12/2017",https://legiscan.com/MI/bill/HB4036/2017,http://legislature.mi.gov/doc.aspx?2017-HB-4036
909955,1414,HB4037,1,Introduced,2017-01-12,"Elections; registration; automatic voter registration when receiving driver license or identification card; provide for. Amends 1954 PA 116 (MCL 168.1 - 168.992) by adding sec. 493a. TIE BAR WITH: HB 4038'17, HB 4039'17","Elections; registration; automatic voter registration when receiving driver license or identification card; provide for. Amends 1954 PA 116 (MCL 168.1 - 168.992) by adding sec. 493a. TIE BAR WITH: HB 4038'17, HB 4039'17",0,,2017-01-18,"Bill Electronically Reproduced 01/12/2017",https://legiscan.com/MI/bill/HB4037/2017,http://legislature.mi.gov/doc.aspx?2017-HB-4037
909765,1414,HB4038,1,Introduced,2017-01-12,"Traffic control; driver license; declaration of United States citizenship on operator's or chauffeur's license application; require for automatic voter registration. Amends sec. 307 of 1949 PA 300 (MCL 257.307). TIE BAR WITH: HB 4037'17","Traffic control; driver license; declaration of United States citizenship on operator's or chauffeur's license application; require for automatic voter registration. Amends sec. 307 of 1949 PA 300 (MCL 257.307). TIE BAR WITH: HB 4037'17",0,,2017-01-18,"Bill Electronically Reproduced 01/12/2017",https://legiscan.com/MI/bill/HB4038/2017,http://legislature.mi.gov/doc.aspx?2017-HB-4038
910524,1414,HB4039,1,Introduced,2017-01-12,"State; identification cards; declaration of United States citizenship on personal identification card application; require for automatic voter registration. Amends sec. 1 of 1972 PA 222 (MCL 28.291). TIE BAR WITH: HB 4037'17","State; identification cards; declaration of United States citizenship on personal identification card application; require for automatic voter registration. Amends sec. 1 of 1972 PA 222 (MCL 28.291). TIE BAR WITH: HB 4037'17",0,,2017-01-18,"Bill Electronically Reproduced 01/12/2017",https://legiscan.com/MI/bill/HB4039/2017,http://legislature.mi.gov/doc.aspx?2017-HB-4039
910389,1414,HB4040,1,Introduced,2017-01-12,"Vehicles; registration; vehicle registration fees; exempt senior citizens from increases. Amends sec. 801 of 1949 PA 300 (MCL 257.801).","Vehicles; registration; vehicle registration fees; exempt senior citizens from increases. Amends sec. 801 of 1949 PA 300 (MCL 257.801).",0,,2017-01-18,"Bill Electronically Reproduced 01/12/2017",https://legiscan.com/MI/bill/HB4040/2017,http://legislature.mi.gov/doc.aspx?2017-HB-4040
917807,1414,HB4041,1,Introduced,2017-01-18,"Insurance; insurers; expired, terminated, or canceled automobile insurance; require notification to secretary of state, and increase fines for second offense of operating vehicle without insurance. Amends secs. 3101a & 3102 of 1956 PA 218 (MCL 500.3101a & 500.3102). TIE BAR WITH: HB 4010'17","Insurance; insurers; expired, terminated, or canceled automobile insurance; require notification to secretary of state, and increase fines for second offense of operating vehicle without insurance. Amends secs. 3101a & 3102 of 1956 PA 218 (MCL 500.3101a & 500.3102). TIE BAR WITH: HB 4010'17",0,,2017-01-18,"Bill Electronically Reproduced 01/18/2017",https://legiscan.com/MI/bill/HB4041/2017,http://legislature.mi.gov/doc.aspx?2017-HB-4041
917655,1414,HB4042,1,Introduced,2017-01-18,"Traffic control; driver license; operating a motor vehicle without valid driver license; increase penalties and require police officers to take certain actions. Amends secs. 904 & 904a of 1949 PA 300 (MCL 257.904 & 257.904a).","Traffic control; driver license; operating a motor vehicle without valid driver license; increase penalties and require police officers to take certain actions. Amends secs. 904 & 904a of 1949 PA 300 (MCL 257.904 & 257.904a).",0,,2017-01-18,"Bill Electronically Reproduced 01/18/2017",https://legiscan.com/MI/bill/HB4042/2017,http://legislature.mi.gov/doc.aspx?2017-HB-4042
917589,1414,HB4043,1,Introduced,2017-01-18,"Law enforcement; communications; missing senior and vulnerable adult plan; establish. Amends title of 2012 PA 176 (MCL 28.711 - 28.718) & adds sec. 2a.","Law enforcement; communications; missing senior and vulnerable adult plan; establish. Amends title of 2012 PA 176 (MCL 28.711 - 28.718) & adds sec. 2a.",0,,2017-01-18,"Bill Electronically Reproduced 01/18/2017",https://legiscan.com/MI/bill/HB4043/2017,http://legislature.mi.gov/doc.aspx?2017-HB-4043
917273,1414,HB4044,1,Introduced,2017-01-18,"Fireworks; use; sale and use of consumer fireworks in densely populated areas; prohibit unless a local unit of government allows by ordinance. Amends sec. 7 of 2011 PA 256 (MCL 28.457).","Fireworks; use; sale and use of consumer fireworks in densely populated areas; prohibit unless a local unit of government allows by ordinance. Amends sec. 7 of 2011 PA 256 (MCL 28.457).",0,,2017-01-18,"Bill Electronically Reproduced 01/18/2017",https://legiscan.com/MI/bill/HB4044/2017,http://legislature.mi.gov/doc.aspx?2017-HB-4044
917468,1414,HB4045,1,Introduced,2017-01-18,"Transportation; school vehicles; seat belts; require on new school buses. Amends 1990 PA 187 (MCL 257.1801 - 257.1877) by adding sec. 22.","Transportation; school vehicles; seat belts; require on new school buses. Amends 1990 PA 187 (MCL 257.1801 - 257.1877) by adding sec. 22.",0,,2017-01-18,"Bill Electronically Reproduced 01/18/2017",https://legiscan.com/MI/bill/HB4045/2017,http://legislature.mi.gov/doc.aspx?2017-HB-4045
917628,1414,HB4046,1,Introduced,2017-01-18,"Education; financing; permissible use of sinking funds; expand to include school bus purchasing. Amends sec. 1212 of 1976 PA 451 (MCL 380.1212).","Education; financing; permissible use of sinking funds; expand to include school bus purchasing. Amends sec. 1212 of 1976 PA 451 (MCL 380.1212).",0,,2017-01-18,"Bill Electronically Reproduced 01/18/2017",https://legiscan.com/MI/bill/HB4046/2017,http://legislature.mi.gov/doc.aspx?2017-HB-4046
917118,1414,HB4047,1,Introduced,2017-01-18,"Property tax; exemptions; eligible broadband equipment; exempt from personal property tax. Amends 1893 PA 206 (MCL 211.1 - 211.155) by adding sec. 9p.","Property tax; exemptions; eligible broadband equipment; exempt from personal property tax. Amends 1893 PA 206 (MCL 211.1 - 211.155) by adding sec. 9p.",0,,2017-10-18,"Recommendation Concurred In",https://legiscan.com/MI/bill/HB4047/2017,http://legislature.mi.gov/doc.aspx?2017-HB-4047
917310,1414,HB4048,2,Engrossed,2017-03-29,"Veterans; veterans' homes; employment preference at veterans' facilities; provide for veterans. Amends 1885 PA 152 (MCL 36.1 - 36.12) by adding sec. 11a.","Veterans; veterans' homes; employment preference at veterans' facilities; provide for veterans. Amends 1885 PA 152 (MCL 36.1 - 36.12) by adding sec. 11a.",2553,"Senate Veterans, Military Affairs And Homeland Security",2017-03-30,"Referred To Committee On Veterans, Military Affairs And Homeland Security",https://legiscan.com/MI/bill/HB4048/2017,http://legislature.mi.gov/doc.aspx?2017-HB-4048
917502,1414,HB4049,1,Introduced,2017-01-18,"Insurance; no-fault; catastrophic claims association; require to disclose actuarial computation used in rate setting. Amends sec. 3104 of 1956 PA 218 (MCL 500.3104).","Insurance; no-fault; catastrophic claims association; require to disclose actuarial computation used in rate setting. Amends sec. 3104 of 1956 PA 218 (MCL 500.3104).",0,,2017-01-18,"Bill Electronically Reproduced 01/18/2017",https://legiscan.com/MI/bill/HB4049/2017,http://legislature.mi.gov/doc.aspx?2017-HB-4049
917696,1414,HB4050,1,Introduced,2017-01-18,"Economic development; neighborhood enterprise zones; definition of rehabilitated facility; modify. Amends sec. 2 of 1992 PA 147 (MCL 207.772).","Economic development; neighborhood enterprise zones; definition of rehabilitated facility; modify. Amends sec. 2 of 1992 PA 147 (MCL 207.772).",0,,2017-01-18,"Bill Electronically Reproduced 01/18/2017",https://legiscan.com/MI/bill/HB4050/2017,http://legislature.mi.gov/doc.aspx?2017-HB-4050
917141,1414,HB4051,1,Introduced,2017-01-18,"Human services; medical services; annual lead screening test for certain children enrolled in Medicaid and MIChild; require. Amends sec. 111k of 1939 PA 280 (MCL 400.111k).","Human services; medical services; annual lead screening test for certain children enrolled in Medicaid and MIChild; require. Amends sec. 111k of 1939 PA 280 (MCL 400.111k).",0,,2017-01-18,"Bill Electronically Reproduced 01/18/2017",https://legiscan.com/MI/bill/HB4051/2017,http://legislature.mi.gov/doc.aspx?2017-HB-4051
917569,1414,HB4052,1,Introduced,2017-01-18,"Individual income tax; retirement or pension benefits; 3-tier limitations and restrictions on deduction for retirement or pension benefits based on taxpayer's age; eliminate. Amends sec. 30 of 1967 PA 281 (MCL 206.30).","Individual income tax; retirement or pension benefits; 3-tier limitations and restrictions on deduction for retirement or pension benefits based on taxpayer's age; eliminate. Amends sec. 30 of 1967 PA 281 (MCL 206.30).",0,,2017-01-18,"Bill Electronically Reproduced 01/18/2017",https://legiscan.com/MI/bill/HB4052/2017,http://legislature.mi.gov/doc.aspx?2017-HB-4052
917171,1414,HB4053,2,Engrossed,2018-02-22,"State; symbol; English; establish as official state language. Creates new act.","State; symbol; English; establish as official state language. Creates new act.",0,,2018-03-22,"Referred To Committee Of The Whole",https://legiscan.com/MI/bill/HB4053/2017,http://legislature.mi.gov/doc.aspx?2017-HB-4053
917539,1414,HB4054,4,Passed,2017-12-28,"Transportation; school vehicles; enhanced rear lighting for school buses; allow. Amends 1990 PA 187 (MCL 257.1801 - 257.1877) by adding sec. 12.","Transportation; school vehicles; enhanced rear lighting for school buses; allow. Amends 1990 PA 187 (MCL 257.1801 - 257.1877) by adding sec. 12.",0,,2017-12-28,"Assigned Pa 233'17 With Immediate Effect",https://legiscan.com/MI/bill/HB4054/2017,http://legislature.mi.gov/doc.aspx?2017-HB-4054
917232,1414,HB4055,1,Introduced,2017-01-18,"Individual income tax; retirement or pension benefits; limitations and restrictions for certain individuals born after 1952; modify. Amends sec. 30 of 1967 PA 281 (MCL 206.30).","Individual income tax; retirement or pension benefits; limitations and restrictions for certain individuals born after 1952; modify. Amends sec. 30 of 1967 PA 281 (MCL 206.30).",0,,2017-01-18,"Bill Electronically Reproduced 01/18/2017",https://legiscan.com/MI/bill/HB4055/2017,http://legislature.mi.gov/doc.aspx?2017-HB-4055
917923,1414,HB4056,1,Introduced,2017-01-18,"Local government; other; distribution of local community stabilization act share revenues; modify. Amends secs. 13 & 16a of 2014 PA 86 (MCL 123.1353 & 123.1356a).","Local government; other; distribution of local community stabilization act share revenues; modify. Amends secs. 13 & 16a of 2014 PA 86 (MCL 123.1353 & 123.1356a).",0,,2017-11-08,"Recommendation Concurred In",https://legiscan.com/MI/bill/HB4056/2017,http://legislature.mi.gov/doc.aspx?2017-HB-4056
917388,1414,HB4057,4,Passed,2017-05-11,"Highways; name; portion of US-12 in the city of Jonesville; designate as the ""James Bondsteel Memorial Highway"". Amends 2001 PA 142 (MCL 250.1001 - 250.2080) by adding sec. 7a.","Highways; name; portion of US-12 in the city of Jonesville; designate as the ""James Bondsteel Memorial Highway"". Amends 2001 PA 142 (MCL 250.1001 - 250.2080) by adding sec. 7a.",0,,2017-05-11,"Assigned Pa 28'17 With Immediate Effect",https://legiscan.com/MI/bill/HB4057/2017,http://legislature.mi.gov/doc.aspx?2017-HB-4057
917206,1414,HB4058,4,Passed,2017-06-07,"Economic development; neighborhood enterprise zones; requirement to send report of assessed values and ad valorem taxes to the Michigan enterprise zone authority; eliminate. Amends sec. 13 of 1992 PA 147 (MCL 207.783) & repeals sec. 14 of 1992 PA 147 (MCL 207.784).","Economic development; neighborhood enterprise zones; requirement to send report of assessed values and ad valorem taxes to the Michigan enterprise zone authority; eliminate. Amends sec. 13 of 1992 PA 147 (MCL 207.783) & repeals sec. 14 of 1992 PA 147 (MCL 207.784).",0,,2017-06-07,"Assigned Pa 44'17 With Immediate Effect",https://legiscan.com/MI/bill/HB4058/2017,http://legislature.mi.gov/doc.aspx?2017-HB-4058
917532,1414,HB4059,1,Introduced,2017-01-18,"Vehicles; other; definition of certain mini campers; provide for, and exclude from dealer license requirement and certificate of title and registration requirements. Amends secs. 11, 40a & 216 of 1949 PA 300 (MCL 257.11 et seq.) & adds sec. 30d.","Vehicles; other; definition of certain mini campers; provide for, and exclude from dealer license requirement and certificate of title and registration requirements. Amends secs. 11, 40a & 216 of 1949 PA 300 (MCL 257.11 et seq.) & adds sec. 30d.",0,,2017-01-18,"Bill Electronically Reproduced 01/18/2017",https://legiscan.com/MI/bill/HB4059/2017,http://legislature.mi.gov/doc.aspx?2017-HB-4059
917372,1414,HB4060,1,Introduced,2017-01-18,"Gaming; casinos; sports betting; allow in casinos under the gaming control and revenue act. Amends 1996 IL 1 (MCL 432.201 - 432.226) by adding sec. 9e.","Gaming; casinos; sports betting; allow in casinos under the gaming control and revenue act. Amends 1996 IL 1 (MCL 432.201 - 432.226) by adding sec. 9e.",0,,2017-01-18,"Bill Electronically Reproduced 01/18/2017",https://legiscan.com/MI/bill/HB4060/2017,http://legislature.mi.gov/doc.aspx?2017-HB-4060
917746,1414,HB4061,1,Introduced,2017-01-18,"Education; safety; school lockdown drills; require reporting of. Amends sec. 19 of 1941 PA 207 (MCL 29.19).","Education; safety; school lockdown drills; require reporting of. Amends sec. 19 of 1941 PA 207 (MCL 29.19).",0,,2017-01-18,"Bill Electronically Reproduced 01/18/2017",https://legiscan.com/MI/bill/HB4061/2017,http://legislature.mi.gov/doc.aspx?2017-HB-4061
917096,1414,HB4062,1,Introduced,2017-01-18,"Traffic control; traffic regulation; traveling in extreme left-hand lane; regulate. Amends sec. 634 of 1949 PA 300 (MCL 257.634).","Traffic control; traffic regulation; traveling in extreme left-hand lane; regulate. Amends sec. 634 of 1949 PA 300 (MCL 257.634).",0,,2017-01-18,"Bill Electronically Reproduced 01/18/2017",https://legiscan.com/MI/bill/HB4062/2017,http://legislature.mi.gov/doc.aspx?2017-HB-4062
929850,1414,HB4063,4,Passed,2017-05-11,"Crimes; other; aiming a beam of directed energy from a directed energy device at or into path of aircraft or moving train; prohibit and provide penalty.","Crimes; other; aiming a beam of directed energy from a directed energy device at or into path of aircraft or moving train; prohibit and provide penalty.",0,,2017-05-11,"Assigned Pa 29'17 With Immediate Effect",https://legiscan.com/MI/bill/HB4063/2017,http://legislature.mi.gov/doc.aspx?2017-HB-4063
929724,1414,HB4064,4,Passed,2017-05-11,"Criminal procedure; sentencing guidelines; sentencing guidelines for crime of aiming beam of directed energy from a directed energy device at aircraft or into path of aircraft or path of moving train; enact.","Criminal procedure; sentencing guidelines; sentencing guidelines for crime of aiming beam of directed energy from a directed energy device at aircraft or into path of aircraft or path of moving train; enact.",0,,2017-05-11,"Assigned Pa 30'17 With Immediate Effect",https://legiscan.com/MI/bill/HB4064/2017,http://legislature.mi.gov/doc.aspx?2017-HB-4064
929882,1414,HB4065,4,Passed,2017-12-13,"Corrections; other; prohibition against the department of corrections hiring a formerly convicted felon; modify. Amends sec. 5a of 1953 PA 232 (MCL 791.205a).","Corrections; other; prohibition against the department of corrections hiring a formerly convicted felon; modify. Amends sec. 5a of 1953 PA 232 (MCL 791.205a).",0,,2017-12-13,"Assigned Pa 191'17 With Immediate Effect",https://legiscan.com/MI/bill/HB4065/2017,http://legislature.mi.gov/doc.aspx?2017-HB-4065
930097,1414,HB4066,4,Passed,2018-12-31,"Health occupations; physicians; interstate medical licensure compact; create. Amends 1978 PA 368 (MCL 333.1101 - 333.25211) by adding sec. 16189 & repeals sec. 16189.","Health occupations; physicians; interstate medical licensure compact; create. Amends 1978 PA 368 (MCL 333.1101 - 333.25211) by adding sec. 16189 & repeals sec. 16189.",0,,2018-12-31,"Assigned Pa 563'18 With Immediate Effect",https://legiscan.com/MI/bill/HB4066/2017,http://legislature.mi.gov/doc.aspx?2017-HB-4066
930067,1414,HB4067,4,Passed,2018-12-31,"Health occupations; physicians; licensing process; modify to incorporate interstate medical licensure compact. Amends secs. 17001 & 17501 of 1978 PA 368 (MCL 333.17001 & 333.17501) & adds secs. 17011a & 17511a.","Health occupations; physicians; licensing process; modify to incorporate interstate medical licensure compact. Amends secs. 17001 & 17501 of 1978 PA 368 (MCL 333.17001 & 333.17501) & adds secs. 17011a & 17511a.",0,,2018-12-31,"Assigned Pa 524'18 With Immediate Effect",https://legiscan.com/MI/bill/HB4067/2017,http://legislature.mi.gov/doc.aspx?2017-HB-4067
930005,1414,HB4068,1,Introduced,2017-01-24,"Property tax; exemptions; exemption of real property owned by qualified conservation clubs; create. Amends sec. 7o of 1893 PA 206 (MCL 211.7o).","Property tax; exemptions; exemption of real property owned by qualified conservation clubs; create. Amends sec. 7o of 1893 PA 206 (MCL 211.7o).",0,,2017-01-25,"Bill Electronically Reproduced 01/24/2017",https://legiscan.com/MI/bill/HB4068/2017,http://legislature.mi.gov/doc.aspx?2017-HB-4068
930128,1414,HB4069,4,Passed,2018-08-15,"Education; teachers; college credit requirements for individual to serve as substitute teacher; revise. Amends sec. 1233 of 1976 PA 451 (MCL 380.1233).","Education; teachers; college credit requirements for individual to serve as substitute teacher; revise. Amends sec. 1233 of 1976 PA 451 (MCL 380.1233).",0,,2018-08-15,"Assigned Pa 236'18 With Immediate Effect",https://legiscan.com/MI/bill/HB4069/2017,http://legislature.mi.gov/doc.aspx?2017-HB-4069
929787,1414,HB4070,2,Engrossed,2017-03-28,"Property; condemnation; requirement that state agencies evaluate government actions that may result in takings; expand to include department of agriculture and rural development, and require agency that fails to review takings assessment to pay court costs and attorney fees. Amends title & secs. 2 & 4 of 1996 PA 101 (MCL 24.422 & 24.424) & adds sec. 6.","Property; condemnation; requirement that state agencies evaluate government actions that may result in takings; expand to include department of agriculture and rural development, and require agency that fails to review takings assessment to pay court costs and attorney fees. Amends title & secs. 2 & 4 of 1996 PA 101 (MCL 24.422 & 24.424) & adds sec. 6.",0,,2018-01-30,"Referred To Committee Of The Whole",https://legiscan.com/MI/bill/HB4070/2017,http://legislature.mi.gov/doc.aspx?2017-HB-4070
929696,1414,HB4071,1,Introduced,2017-01-24,"Criminal procedure; bail; detention and denial of bail after certain convictions but before sentencing; expand to include child abuse. Amends sec. 9a, ch. X of 1927 PA 175 (MCL 770.9a).","Criminal procedure; bail; detention and denial of bail after certain convictions but before sentencing; expand to include child abuse. Amends sec. 9a, ch. X of 1927 PA 175 (MCL 770.9a).",0,,2017-01-25,"Bill Electronically Reproduced 01/24/2017",https://legiscan.com/MI/bill/HB4071/2017,http://legislature.mi.gov/doc.aspx?2017-HB-4071
930035,1414,HB4072,1,Introduced,2017-01-24,"Crimes; gangs; sentencing guidelines for crime of participating in a gang; enact. Amends sec. 16t, ch. XVII of 1927 PA 175 (MCL 777.16t). TIE BAR WITH: HB 4073'17","Crimes; gangs; sentencing guidelines for crime of participating in a gang; enact. Amends sec. 16t, ch. XVII of 1927 PA 175 (MCL 777.16t). TIE BAR WITH: HB 4073'17",0,,2017-01-25,"Bill Electronically Reproduced 01/24/2017",https://legiscan.com/MI/bill/HB4072/2017,http://legislature.mi.gov/doc.aspx?2017-HB-4072
929910,1414,HB4073,1,Introduced,2017-01-24,"Crimes; gangs; gang participation; prohibit, and provide a penalty. Amends sec. 411u of 1931 PA 328 (MCL 750.411u).","Crimes; gangs; gang participation; prohibit, and provide a penalty. Amends sec. 411u of 1931 PA 328 (MCL 750.411u).",0,,2017-01-25,"Bill Electronically Reproduced 01/24/2017",https://legiscan.com/MI/bill/HB4073/2017,http://legislature.mi.gov/doc.aspx?2017-HB-4073
930188,1414,HB4074,1,Introduced,2017-01-24,"Insurance; health insurers; abuse-deterrent opioid analgesic drug; require coverage. Amends 1956 PA 218 (MCL 500.100 - 500.8302) by adding sec. 3406u.","Insurance; health insurers; abuse-deterrent opioid analgesic drug; require coverage. Amends 1956 PA 218 (MCL 500.100 - 500.8302) by adding sec. 3406u.",0,,2017-01-25,"Bill Electronically Reproduced 01/24/2017",https://legiscan.com/MI/bill/HB4074/2017,http://legislature.mi.gov/doc.aspx?2017-HB-4074
929941,1414,HB4075,1,Introduced,2017-01-24,"Elections; scheduling; election of county executive in an optional unified form of county government; modify election schedule to the gubernatorial election years. Amends sec. 9 of 1973 PA 139 (MCL 45.559).","Elections; scheduling; election of county executive in an optional unified form of county government; modify election schedule to the gubernatorial election years. Amends sec. 9 of 1973 PA 139 (MCL 45.559).",0,,2017-01-25,"Bill Electronically Reproduced 01/24/2017",https://legiscan.com/MI/bill/HB4075/2017,http://legislature.mi.gov/doc.aspx?2017-HB-4075
929975,1414,HB4076,1,Introduced,2017-01-24,"Criminal procedure; sentencing guidelines; sentencing guidelines for altering or tampering with data in an official report; enact. Amends sec. 16x, ch. XVII of 1927 PA 175 (MCL 777.16x).","Criminal procedure; sentencing guidelines; sentencing guidelines for altering or tampering with data in an official report; enact. Amends sec. 16x, ch. XVII of 1927 PA 175 (MCL 777.16x).",0,,2017-03-21,"Recommendation Concurred In",https://legiscan.com/MI/bill/HB4076/2017,http://legislature.mi.gov/doc.aspx?2017-HB-4076
929819,1414,HB4077,2,Engrossed,2017-03-16,"Civil rights; public records; prohibition for public bodies commencing civil actions against entities making FOIA requests; implement in freedom of information act. Amends 1976 PA 442 (MCL 15.231 - 15.246) by adding sec. 5a.","Civil rights; public records; prohibition for public bodies commencing civil actions against entities making FOIA requests; implement in freedom of information act. Amends 1976 PA 442 (MCL 15.231 - 15.246) by adding sec. 5a.",838,"Senate Government Operations",2017-03-21,"Referred To Committee On Government Operations",https://legiscan.com/MI/bill/HB4077/2017,http://legislature.mi.gov/doc.aspx?2017-HB-4077
930158,1414,HB4078,1,Introduced,2017-01-24,"Crimes; intoxication or impairment; driver license sanctions; provide for. Amends secs. 304, 319, 625e & 625f of 1949 PA 300 (MCL 257.304 et seq.).","Crimes; intoxication or impairment; driver license sanctions; provide for. Amends secs. 304, 319, 625e & 625f of 1949 PA 300 (MCL 257.304 et seq.).",0,,2017-01-25,"Bill Electronically Reproduced 01/24/2017",https://legiscan.com/MI/bill/HB4078/2017,http://legislature.mi.gov/doc.aspx?2017-HB-4078
929756,1414,HB4079,1,Introduced,2017-01-24,"Liquor; licenses; restrictions on the issuance or transfer of specially designated distributor licenses; modify. Amends sec. 531 of 1998 PA 58 (MCL 436.1531).","Liquor; licenses; restrictions on the issuance or transfer of specially designated distributor licenses; modify. Amends sec. 531 of 1998 PA 58 (MCL 436.1531).",0,,2017-01-25,"Bill Electronically Reproduced 01/24/2017",https://legiscan.com/MI/bill/HB4079/2017,http://legislature.mi.gov/doc.aspx?2017-HB-4079
929671,1414,HB4080,4,Passed,2017-05-02,"State financing and management; other; certain forms of energy improvement financing for certain school districts; provide for. Amends sec. 1274a of 1976 PA 451 (MCL 380.1274a).","State financing and management; other; certain forms of energy improvement financing for certain school districts; provide for. Amends sec. 1274a of 1976 PA 451 (MCL 380.1274a).",0,,2017-05-02,"Assigned Pa 23'17 With Immediate Effect",https://legiscan.com/MI/bill/HB4080/2017,http://legislature.mi.gov/doc.aspx?2017-HB-4080
930219,1414,HB4081,5,Vetoed,2018-12-31,"Gaming; bingo and charitable gaming; millionaire parties; provide for general amendments. Amends secs. 2, 3, 3a, 4, 4a, 8, 9, 10, 11b, 12, 13, 14, 15, 16 & 19 of 1972 PA 382 (MCL 432.102 et seq.); designates secs. 1 to 20 as art. 1; adds art. 2 & repeals secs. 10a, 10b & 20 of 1972 PA 382 (MCL 432.110a et seq.).","Gaming; bingo and charitable gaming; millionaire parties; provide for general amendments. Amends secs. 2, 3, 3a, 4, 4a, 8, 9, 10, 11b, 12, 13, 14, 15, 16 & 19 of 1972 PA 382 (MCL 432.102 et seq.); designates secs. 1 to 20 as art. 1; adds art. 2 & repeals secs. 10a, 10b & 20 of 1972 PA 382 (MCL 432.110a et seq.).",0,,2018-12-31,"Vetoed By The Governor 12/28/2018 12/31/18 Addenda",https://legiscan.com/MI/bill/HB4081/2017,http://legislature.mi.gov/doc.aspx?2017-HB-4081
932449,1414,HB4082,4,Passed,2017-07-12,"Natural resources; other; DNR prescribed burns; require notification to township supervisor and 9-1-1 service. Amends secs. 51501 & 51506 of 1994 PA 451 (MCL 324.51501 & 324.51506) & adds sec. 51503c.","Natural resources; other; DNR prescribed burns; require notification to township supervisor and 9-1-1 service. Amends secs. 51501 & 51506 of 1994 PA 451 (MCL 324.51501 & 324.51506) & adds sec. 51503c.",0,,2017-07-12,"Assigned Pa 60'17 With Immediate Effect",https://legiscan.com/MI/bill/HB4082/2017,http://legislature.mi.gov/doc.aspx?2017-HB-4082
932319,1414,HB4083,1,Introduced,2017-01-25,"Individual income tax; retirement or pension benefits; deduction for all retirement or pension benefits after person reaches the age of 64; provide for. Amends sec. 30 of 1967 PA 281 (MCL 206.30).","Individual income tax; retirement or pension benefits; deduction for all retirement or pension benefits after person reaches the age of 64; provide for. Amends sec. 30 of 1967 PA 281 (MCL 206.30).",0,,2017-01-26,"Bill Electronically Reproduced 01/25/2017",https://legiscan.com/MI/bill/HB4083/2017,http://legislature.mi.gov/doc.aspx?2017-HB-4083
932274,1414,HB4084,2,Engrossed,2018-03-13,"Education; teachers; reading disability diagnostics course requirement for professional certification; eliminate. Amends sec. 1531 of 1976 PA 451 (MCL 380.1531).","Education; teachers; reading disability diagnostics course requirement for professional certification; eliminate. Amends sec. 1531 of 1976 PA 451 (MCL 380.1531).",0,,2018-06-06,"Referred To Committee Of The Whole",https://legiscan.com/MI/bill/HB4084/2017,http://legislature.mi.gov/doc.aspx?2017-HB-4084
932580,1414,HB4085,1,Introduced,2017-01-25,"Education; calendar; qualifying professional development days or hours for teachers; allow to be counted as pupil instructional time. Amends sec. 101 of 1979 PA 94 (MCL 388.1701).","Education; calendar; qualifying professional development days or hours for teachers; allow to be counted as pupil instructional time. Amends sec. 101 of 1979 PA 94 (MCL 388.1701).",0,,2017-01-26,"Bill Electronically Reproduced 01/25/2017",https://legiscan.com/MI/bill/HB4085/2017,http://legislature.mi.gov/doc.aspx?2017-HB-4085
932192,1414,HB4086,1,Introduced,2017-01-25,"Occupations; inspectors; licensure and regulation of home inspection services; provide for, and require certain disclosures and contract provisions. Amends secs. 303a, 401 & 601 of 1980 PA 299 (MCL 339.303a et seq.) & adds art. 14.","Occupations; inspectors; licensure and regulation of home inspection services; provide for, and require certain disclosures and contract provisions. Amends secs. 303a, 401 & 601 of 1980 PA 299 (MCL 339.303a et seq.) & adds art. 14.",0,,2017-01-26,"Bill Electronically Reproduced 01/25/2017",https://legiscan.com/MI/bill/HB4086/2017,http://legislature.mi.gov/doc.aspx?2017-HB-4086
932493,1414,HB4087,1,Introduced,2017-01-25,"Financial institutions; money transmitters; posting of fees for money orders and other money transmission services; require. Amends 2006 PA 250 (MCL 487.1001 - 487.1047) by adding sec. 35.","Financial institutions; money transmitters; posting of fees for money orders and other money transmission services; require. Amends 2006 PA 250 (MCL 487.1001 - 487.1047) by adding sec. 35.",0,,2017-01-26,"Bill Electronically Reproduced 01/25/2017",https://legiscan.com/MI/bill/HB4087/2017,http://legislature.mi.gov/doc.aspx?2017-HB-4087
932538,1414,HB4088,1,Introduced,2017-01-25,"Traffic control; traffic regulation; penalties for crime of failing to yield to or stop for approaching authorized emergency vehicle thereby causing injury or death to emergency personnel; amend. Amends sec. 653 of 1949 PA 300 (MCL 257.653).","Traffic control; traffic regulation; penalties for crime of failing to yield to or stop for approaching authorized emergency vehicle thereby causing injury or death to emergency personnel; amend. Amends sec. 653 of 1949 PA 300 (MCL 257.653).",0,,2017-01-26,"Bill Electronically Reproduced 01/25/2017",https://legiscan.com/MI/bill/HB4088/2017,http://legislature.mi.gov/doc.aspx?2017-HB-4088
932406,1414,HB4089,1,Introduced,2017-01-25,"Criminal procedure; sentencing guidelines; sentencing guidelines for crime of failing to yield or stop upon immediate approach of authorized emergency vehicle; provide for. Amends sec. 12g, ch. XVII of 1927 PA 175 (MCL 777.12g). TIE BAR WITH: HB 4088'17","Criminal procedure; sentencing guidelines; sentencing guidelines for crime of failing to yield or stop upon immediate approach of authorized emergency vehicle; provide for. Amends sec. 12g, ch. XVII of 1927 PA 175 (MCL 777.12g). TIE BAR WITH: HB 4088'17",0,,2017-01-26,"Bill Electronically Reproduced 01/25/2017",https://legiscan.com/MI/bill/HB4089/2017,http://legislature.mi.gov/doc.aspx?2017-HB-4089
932623,1414,HB4090,1,Introduced,2017-01-25,"Education; school districts; policy and procedures regarding closure of a school building; require. Amends 1976 PA 451 (MCL 380.1 - 380.1852) by adding sec. 1258.","Education; school districts; policy and procedures regarding closure of a school building; require. Amends 1976 PA 451 (MCL 380.1 - 380.1852) by adding sec. 1258.",0,,2017-01-26,"Bill Electronically Reproduced 01/25/2017",https://legiscan.com/MI/bill/HB4090/2017,http://legislature.mi.gov/doc.aspx?2017-HB-4090
934323,1414,HB4091,1,Introduced,2017-01-26,"Mental health; community mental health; funding for mental health entities; modify. Amends sec. 308 of 1974 PA 258 (MCL 330.1308).","Mental health; community mental health; funding for mental health entities; modify. Amends sec. 308 of 1974 PA 258 (MCL 330.1308).",0,,2017-01-31,"Bill Electronically Reproduced 01/26/2017",https://legiscan.com/MI/bill/HB4091/2017,http://legislature.mi.gov/doc.aspx?2017-HB-4091
934290,1414,HB4092,1,Introduced,2017-01-26,"Individual income tax; deductions; 3-tier limitations and restrictions on deduction for retirement or pension benefits based on taxpayer's age; eliminate. Amends sec. 30 of 1967 PA 281 (MCL 206.30).","Individual income tax; deductions; 3-tier limitations and restrictions on deduction for retirement or pension benefits based on taxpayer's age; eliminate. Amends sec. 30 of 1967 PA 281 (MCL 206.30).",0,,2017-01-31,"Bill Electronically Reproduced 01/26/2017",https://legiscan.com/MI/bill/HB4092/2017,http://legislature.mi.gov/doc.aspx?2017-HB-4092
934163,1414,HB4093,1,Introduced,2017-01-26,"Public utilities; natural gas utilities; infrastructure expansion investment costs for certain underserved or unserved areas; allow natural gas utilities to recover. Amends 1939 PA 3 (MCL 460.1 - 460.11) by adding sec. 9u & repeals sec. 9u.","Public utilities; natural gas utilities; infrastructure expansion investment costs for certain underserved or unserved areas; allow natural gas utilities to recover. Amends 1939 PA 3 (MCL 460.1 - 460.11) by adding sec. 9u & repeals sec. 9u.",0,,2017-01-31,"Bill Electronically Reproduced 01/26/2017",https://legiscan.com/MI/bill/HB4093/2017,http://legislature.mi.gov/doc.aspx?2017-HB-4093
934236,1414,HB4094,1,Introduced,2017-01-26,"Consumer credit; credit reports and reporting agencies; free credit freeze for active duty military personnel; provide for. Amends sec. 31 of 2013 PA 229 (MCL 445.2541).","Consumer credit; credit reports and reporting agencies; free credit freeze for active duty military personnel; provide for. Amends sec. 31 of 2013 PA 229 (MCL 445.2541).",0,,2017-01-31,"Bill Electronically Reproduced 01/26/2017",https://legiscan.com/MI/bill/HB4094/2017,http://legislature.mi.gov/doc.aspx?2017-HB-4094
934114,1414,HB4095,1,Introduced,2017-01-26,"Natural resources; hunting; lotteries for hunting; provide first preference to veterans. Amends 1994 PA 451 (MCL 324.101 - 324.90106) by adding sec. 43536b.","Natural resources; hunting; lotteries for hunting; provide first preference to veterans. Amends 1994 PA 451 (MCL 324.101 - 324.90106) by adding sec. 43536b.",0,,2017-01-31,"Bill Electronically Reproduced 01/26/2017",https://legiscan.com/MI/bill/HB4095/2017,http://legislature.mi.gov/doc.aspx?2017-HB-4095
934448,1414,HB4096,1,Introduced,2017-01-26,"Civil procedure; personal protection orders; child custody and child and spousal support; allow to be included. Amends sec. 2950 of 1961 PA 236 (MCL 600.2950).","Civil procedure; personal protection orders; child custody and child and spousal support; allow to be included. Amends sec. 2950 of 1961 PA 236 (MCL 600.2950).",0,,2017-01-31,"Bill Electronically Reproduced 01/26/2017",https://legiscan.com/MI/bill/HB4096/2017,http://legislature.mi.gov/doc.aspx?2017-HB-4096
934395,1414,HB4097,1,Introduced,2017-01-26,"Insurance; no-fault; short-term policies; require to include certain charges in premium and to make those charges nonrefundable. Amends secs. 3020 & 3104 of 1956 PA 218 (MCL 500.3020 & 500.3104) & adds sec. 2111f.","Insurance; no-fault; short-term policies; require to include certain charges in premium and to make those charges nonrefundable. Amends secs. 3020 & 3104 of 1956 PA 218 (MCL 500.3020 & 500.3104) & adds sec. 2111f.",0,,2017-01-31,"Bill Electronically Reproduced 01/26/2017",https://legiscan.com/MI/bill/HB4097/2017,http://legislature.mi.gov/doc.aspx?2017-HB-4097
934184,1414,HB4098,1,Introduced,2017-01-26,"Vehicles; registration plates; 30-day license plate; establish, and require individual to have 30-day insurance policy. Amends secs. 226, 226a, 226b & 227 of 1949 PA 300 (MCL 257.226 et seq.).","Vehicles; registration plates; 30-day license plate; establish, and require individual to have 30-day insurance policy. Amends secs. 226, 226a, 226b & 227 of 1949 PA 300 (MCL 257.226 et seq.).",0,,2017-01-31,"Bill Electronically Reproduced 01/26/2017",https://legiscan.com/MI/bill/HB4098/2017,http://legislature.mi.gov/doc.aspx?2017-HB-4098
934271,1414,HB4099,1,Introduced,2017-01-26,"Trade; vehicles; certain installment sale vehicle buyers; require monthly proof of insurance to seller. Amends 1950 (Ex Sess) PA 27 (MCL 492.101 - 492.141) by adding sec. 16b.","Trade; vehicles; certain installment sale vehicle buyers; require monthly proof of insurance to seller. Amends 1950 (Ex Sess) PA 27 (MCL 492.101 - 492.141) by adding sec. 16b.",0,,2017-01-31,"Bill Electronically Reproduced 01/26/2017",https://legiscan.com/MI/bill/HB4099/2017,http://legislature.mi.gov/doc.aspx?2017-HB-4099
934146,1414,HB4100,1,Introduced,2017-01-26,"Local government; water and sewer; municipal stormwater utilities; provide for, and authorize fee. Creates new act.","Local government; water and sewer; municipal stormwater utilities; provide for, and authorize fee. Creates new act.",0,,2017-01-31,"Bill Electronically Reproduced 01/26/2017",https://legiscan.com/MI/bill/HB4100/2017,http://legislature.mi.gov/doc.aspx?2017-HB-4100
934411,1414,HB4101,2,Engrossed,2018-03-07,"Corrections; parole; procedures for parole of prisoner who is determined to be medically frail; revise. Amends sec. 35 of 1953 PA 232 (MCL 791.235). TIE BAR WITH: HB 4102'17","Corrections; parole; procedures for parole of prisoner who is determined to be medically frail; revise. Amends sec. 35 of 1953 PA 232 (MCL 791.235). TIE BAR WITH: HB 4102'17",0,,2018-05-17,"Referred To Committee Of The Whole With Substitute S-1",https://legiscan.com/MI/bill/HB4101/2017,http://legislature.mi.gov/doc.aspx?2017-HB-4101
934343,1414,HB4102,2,Engrossed,2018-03-07,"Corrections; parole; corrections code of 1953; amend to implement medically frail parole. Amends secs. 33, 33b & 34 of 1953 PA 232 (MCL 791.233 et seq.). TIE BAR WITH: HB 4101'17","Corrections; parole; corrections code of 1953; amend to implement medically frail parole. Amends secs. 33, 33b & 34 of 1953 PA 232 (MCL 791.233 et seq.). TIE BAR WITH: HB 4101'17",0,,2018-05-17,"Referred To Committee Of The Whole With Substitute S-1",https://legiscan.com/MI/bill/HB4102/2017,http://legislature.mi.gov/doc.aspx?2017-HB-4102
934465,1414,HB4103,2,Engrossed,2018-03-07,"Crimes; penalties; penalties for removal of a parolee from a facility who was placed there as a condition of his or her parole; provide for. Amends 1931 PA 328 (MCL 750.1 - 750.568) by adding sec. 197d. TIE BAR WITH: HB 4101'17","Crimes; penalties; penalties for removal of a parolee from a facility who was placed there as a condition of his or her parole; provide for. Amends 1931 PA 328 (MCL 750.1 - 750.568) by adding sec. 197d. TIE BAR WITH: HB 4101'17",0,,2018-05-17,"Referred To Committee Of The Whole With Substitute S-1",https://legiscan.com/MI/bill/HB4103/2017,http://legislature.mi.gov/doc.aspx?2017-HB-4103
934483,1414,HB4104,1,Introduced,2017-01-26,"Property tax; exemptions; requirement to issue a receipt to disabled veteran filing an affidavit for exemption of property taxes; provide for. Amends sec. 7b of 1893 PA 206 (MCL 211.7b).","Property tax; exemptions; requirement to issue a receipt to disabled veteran filing an affidavit for exemption of property taxes; provide for. Amends sec. 7b of 1893 PA 206 (MCL 211.7b).",0,,2017-01-31,"Bill Electronically Reproduced 01/26/2017",https://legiscan.com/MI/bill/HB4104/2017,http://legislature.mi.gov/doc.aspx?2017-HB-4104
934517,1414,HB4105,1,Introduced,2017-01-26,"Local government; other; sanctuary policy prohibition act; create. Creates new act.","Local government; other; sanctuary policy prohibition act; create. Creates new act.",0,,2017-06-07,"Referred To Second Reading",https://legiscan.com/MI/bill/HB4105/2017,http://legislature.mi.gov/doc.aspx?2017-HB-4105
934256,1414,HB4106,4,Passed,2018-08-15,"Education; curriculum; granting academic credit for internship; require under certain circumstances. Amends 1976 PA 451 (MCL 380.1 - 380.1852) by adding sec. 1279h. TIE BAR WITH: HB 5676'18","Education; curriculum; granting academic credit for internship; require under certain circumstances. Amends 1976 PA 451 (MCL 380.1 - 380.1852) by adding sec. 1279h. TIE BAR WITH: HB 5676'18",0,,2018-08-15,"Assigned Pa 184'18 With Immediate Effect",https://legiscan.com/MI/bill/HB4106/2017,http://legislature.mi.gov/doc.aspx?2017-HB-4106
934307,1414,HB4107,1,Introduced,2017-01-26,"Occupations; junk and secondhand dealers; licensing of junk or secondhand dealer; require in townships. Amends secs. 1, 2, 3 & 6 of 1917 PA 350 (MCL 445.401 et seq.).","Occupations; junk and secondhand dealers; licensing of junk or secondhand dealer; require in townships. Amends secs. 1, 2, 3 & 6 of 1917 PA 350 (MCL 445.401 et seq.).",0,,2017-01-31,"Bill Electronically Reproduced 01/26/2017",https://legiscan.com/MI/bill/HB4107/2017,http://legislature.mi.gov/doc.aspx?2017-HB-4107
934533,1414,HB4108,1,Introduced,2017-01-26,"Traffic control; speed restrictions; passing vehicle on certain roads; allow to pass at rate above speed limit under certain circumstances. Amends sec. 638 of 1949 PA 300 (MCL 257.638).","Traffic control; speed restrictions; passing vehicle on certain roads; allow to pass at rate above speed limit under certain circumstances. Amends sec. 638 of 1949 PA 300 (MCL 257.638).",0,,2017-01-31,"Bill Electronically Reproduced 01/26/2017",https://legiscan.com/MI/bill/HB4108/2017,http://legislature.mi.gov/doc.aspx?2017-HB-4108
934128,1414,HB4109,1,Introduced,2017-01-26,"Individual income tax; exemptions; personal exemption; increase. Amends sec. 30a of 1967 PA 281 (MCL 206.30a.)","Individual income tax; exemptions; personal exemption; increase. Amends sec. 30a of 1967 PA 281 (MCL 206.30a.)",0,,2017-01-31,"Bill Electronically Reproduced 01/26/2017",https://legiscan.com/MI/bill/HB4109/2017,http://legislature.mi.gov/doc.aspx?2017-HB-4109
934502,1414,HB4110,1,Introduced,2017-01-26,"Holidays; other; ""Fred Korematsu Day""; designate as January 30 of each year.","Holidays; other; ""Fred Korematsu Day""; designate as January 30 of each year.",0,,2017-01-31,"Bill Electronically Reproduced 01/26/2017",https://legiscan.com/MI/bill/HB4110/2017,http://legislature.mi.gov/doc.aspx?2017-HB-4110
934219,1414,HB4111,1,Introduced,2017-01-26,"Individual income tax; veterans; property tax credit; increase for certain qualified veterans. Amends sec. 522 of 1967 PA 281 (MCL 206.522).","Individual income tax; veterans; property tax credit; increase for certain qualified veterans. Amends sec. 522 of 1967 PA 281 (MCL 206.522).",0,,2017-01-31,"Bill Electronically Reproduced 01/26/2017",https://legiscan.com/MI/bill/HB4111/2017,http://legislature.mi.gov/doc.aspx?2017-HB-4111
934378,1414,HB4112,1,Introduced,2017-01-26,"Labor; fair employment practices; use of credit history in the hiring process; prohibit. Creates new act.","Labor; fair employment practices; use of credit history in the hiring process; prohibit. Creates new act.",0,,2017-01-31,"Bill Electronically Reproduced 01/26/2017",https://legiscan.com/MI/bill/HB4112/2017,http://legislature.mi.gov/doc.aspx?2017-HB-4112
934361,1414,HB4113,1,Introduced,2017-01-26,"Individual income tax; deductions; deductions; federal deduction for certain outsourcing expenses; add back. Amends sec. 623 of 1967 PA 281 (MCL 206.623).","Individual income tax; deductions; deductions; federal deduction for certain outsourcing expenses; add back. Amends sec. 623 of 1967 PA 281 (MCL 206.623).",0,,2017-01-31,"Bill Electronically Reproduced 01/26/2017",https://legiscan.com/MI/bill/HB4113/2017,http://legislature.mi.gov/doc.aspx?2017-HB-4113
939379,1414,HB4114,1,Introduced,2017-01-31,"Education; curriculum; foreign language requirement; allow to be fulfilled by completion of computer coding courses. Amends sec. 1278a of 1976 PA 451 (MCL 380.1278a).","Education; curriculum; foreign language requirement; allow to be fulfilled by completion of computer coding courses. Amends sec. 1278a of 1976 PA 451 (MCL 380.1278a).",0,,2017-02-01,"Bill Electronically Reproduced 01/31/2017",https://legiscan.com/MI/bill/HB4114/2017,http://legislature.mi.gov/doc.aspx?2017-HB-4114
938591,1414,HB4115,4,Passed,2018-08-15,"Sales tax; exemptions; sales at retail for fund-raising activities by nonprofit organizations; increase exempt amount. Amends sec. 4o of 1933 PA 167 (MCL 205.54o).","Sales tax; exemptions; sales at retail for fund-raising activities by nonprofit organizations; increase exempt amount. Amends sec. 4o of 1933 PA 167 (MCL 205.54o).",0,,2018-08-15,"Assigned Pa 249'18 With Immediate Effect",https://legiscan.com/MI/bill/HB4115/2017,http://legislature.mi.gov/doc.aspx?2017-HB-4115
939086,1414,HB4116,1,Introduced,2017-01-31,"Campaign finance; campaign practices; automated campaign telephone calls; require to identify who paid for call. Amends 1976 PA 388 (MCL 169.201 - 169.282) by adding sec. 48.","Campaign finance; campaign practices; automated campaign telephone calls; require to identify who paid for call. Amends 1976 PA 388 (MCL 169.201 - 169.282) by adding sec. 48.",0,,2017-02-01,"Bill Electronically Reproduced 01/31/2017",https://legiscan.com/MI/bill/HB4116/2017,http://legislature.mi.gov/doc.aspx?2017-HB-4116
939405,1414,HB4117,1,Introduced,2017-01-31,"Insurance; producers; license eligibility; modify. Amends secs. 1205 & 1239 of 1956 PA 218 (MCL 500.1205 & 500.1239).","Insurance; producers; license eligibility; modify. Amends secs. 1205 & 1239 of 1956 PA 218 (MCL 500.1205 & 500.1239).",0,,2017-02-01,"Bill Electronically Reproduced 01/31/2017",https://legiscan.com/MI/bill/HB4117/2017,http://legislature.mi.gov/doc.aspx?2017-HB-4117
938774,1414,HB4118,2,Engrossed,2018-01-31,"Civil procedure; other; sentencing guidelines for crime of prisoner in holding cell, jail, or correctional facility throwing bodily material on certain individuals; enact. Amends sec. 16t, ch. XVII of 1927 PA 175 (MCL 777.16t). TIE BAR WITH: HB 4119'17","Civil procedure; other; sentencing guidelines for crime of prisoner in holding cell, jail, or correctional facility throwing bodily material on certain individuals; enact. Amends sec. 16t, ch. XVII of 1927 PA 175 (MCL 777.16t). TIE BAR WITH: HB 4119'17",0,,2018-02-22,"Referred To Committee Of The Whole",https://legiscan.com/MI/bill/HB4118/2017,http://legislature.mi.gov/doc.aspx?2017-HB-4118
938802,1414,HB4119,2,Engrossed,2018-01-31,"Crimes; other; detainee or prisoner in holding cell, jail, or correctional facility throwing bodily material on certain individuals; prohibit, and provide a penalty. Amends 1931 PA 328 (MCL 750.1 - 750.568) by adding sec. 411x.","Crimes; other; detainee or prisoner in holding cell, jail, or correctional facility throwing bodily material on certain individuals; prohibit, and provide a penalty. Amends 1931 PA 328 (MCL 750.1 - 750.568) by adding sec. 411x.",0,,2018-02-22,"Referred To Committee Of The Whole",https://legiscan.com/MI/bill/HB4119/2017,http://legislature.mi.gov/doc.aspx?2017-HB-4119
938721,1414,HB4120,1,Introduced,2017-01-31,"Water; quality; testing for levels of lead and other contaminants in water supplied to public schools; require. Amends 1976 PA 399 (MCL 325.1001 - 325.1023) by adding sec. 7a.","Water; quality; testing for levels of lead and other contaminants in water supplied to public schools; require. Amends 1976 PA 399 (MCL 325.1001 - 325.1023) by adding sec. 7a.",0,,2017-02-01,"Bill Electronically Reproduced 01/31/2017",https://legiscan.com/MI/bill/HB4120/2017,http://legislature.mi.gov/doc.aspx?2017-HB-4120
938617,1414,HB4121,1,Introduced,2017-01-31,"Public utilities; water utilities; annual water rate disclosure; require, and provide specific information regarding shut-off statistics. Creates new act.","Public utilities; water utilities; annual water rate disclosure; require, and provide specific information regarding shut-off statistics. Creates new act.",0,,2017-02-01,"Bill Electronically Reproduced 01/31/2017",https://legiscan.com/MI/bill/HB4121/2017,http://legislature.mi.gov/doc.aspx?2017-HB-4121
938641,1414,HB4122,1,Introduced,2017-01-31,"Legislature; apportionment; citizens redistricting commission; create. Creates new act. TIE BAR WITH: HJR B'17","Legislature; apportionment; citizens redistricting commission; create. Creates new act. TIE BAR WITH: HJR B'17",0,,2017-02-01,"Bill Electronically Reproduced 01/31/2017",https://legiscan.com/MI/bill/HB4122/2017,http://legislature.mi.gov/doc.aspx?2017-HB-4122
938669,1414,HB4123,1,Introduced,2017-01-31,"Environmental protection; cleanups; cleanup to residential and safe drinking water standards; require unless technically infeasible. Amends secs. 20118, 20120a, 20120b, 20120e & 20121 of 1994 PA 451 (MCL 324.20118 et seq.).","Environmental protection; cleanups; cleanup to residential and safe drinking water standards; require unless technically infeasible. Amends secs. 20118, 20120a, 20120b, 20120e & 20121 of 1994 PA 451 (MCL 324.20118 et seq.).",0,,2017-02-01,"Bill Electronically Reproduced 01/31/2017",https://legiscan.com/MI/bill/HB4123/2017,http://legislature.mi.gov/doc.aspx?2017-HB-4123
939352,1414,HB4124,1,Introduced,2017-01-31,"Water; quality; program for testing and removing lead in drinking water used by schools and child care centers; provide for. Amends sec. 2 of 1976 PA 399 (MCL 325.1002) & adds sec. 7a.","Water; quality; program for testing and removing lead in drinking water used by schools and child care centers; provide for. Amends sec. 2 of 1976 PA 399 (MCL 325.1002) & adds sec. 7a.",0,,2018-11-28,"Referred To Second Reading",https://legiscan.com/MI/bill/HB4124/2017,http://legislature.mi.gov/doc.aspx?2017-HB-4124
938545,1414,HB4125,1,Introduced,2017-01-31,"Water; quality; testing for lead and copper in drinking water; require, and specify procedures. Amends sec. 2 of 1976 PA 399 (MCL 325.1002) & adds secs. 7a & 7b.","Water; quality; testing for lead and copper in drinking water; require, and specify procedures. Amends sec. 2 of 1976 PA 399 (MCL 325.1002) & adds secs. 7a & 7b.",0,,2017-02-01,"Bill Electronically Reproduced 01/31/2017",https://legiscan.com/MI/bill/HB4125/2017,http://legislature.mi.gov/doc.aspx?2017-HB-4125
939433,1414,HB4126,1,Introduced,2017-01-31,"Holidays; other; ""Michigan Day""; designate as January 26. Creates new act.","Holidays; other; ""Michigan Day""; designate as January 26. Creates new act.",0,,2017-02-01,"Bill Electronically Reproduced 01/31/2017",https://legiscan.com/MI/bill/HB4126/2017,http://legislature.mi.gov/doc.aspx?2017-HB-4126
939484,1414,HB4127,2,Engrossed,2017-06-20,"Vehicles; other; operation of electric patrol vehicles on sidewalks; permit under certain circumstances and modify certain equipment requirements. Amends secs. 2, 4, 5 & 6 of 1997 PA 55 (MCL 257.1572 et seq.).","Vehicles; other; operation of electric patrol vehicles on sidewalks; permit under certain circumstances and modify certain equipment requirements. Amends secs. 2, 4, 5 & 6 of 1997 PA 55 (MCL 257.1572 et seq.).",847,"Senate Transportation",2017-06-21,"Referred To Committee On Transportation",https://legiscan.com/MI/bill/HB4127/2017,http://legislature.mi.gov/doc.aspx?2017-HB-4127
939167,1414,HB4128,1,Introduced,2017-01-31,"Use tax; exemptions; sale of feminine hygiene products; exempt. Amends sec. 4 of 1937 PA 94 (MCL 205.94).","Use tax; exemptions; sale of feminine hygiene products; exempt. Amends sec. 4 of 1937 PA 94 (MCL 205.94).",0,,2017-02-01,"Bill Electronically Reproduced 01/31/2017",https://legiscan.com/MI/bill/HB4128/2017,http://legislature.mi.gov/doc.aspx?2017-HB-4128
939221,1414,HB4129,1,Introduced,2017-01-31,"Sales tax; exemptions; sale of feminine hygiene products; exempt. Amends sec. 4a of 1933 PA 167 (MCL 205.54a).","Sales tax; exemptions; sale of feminine hygiene products; exempt. Amends sec. 4a of 1933 PA 167 (MCL 205.54a).",0,,2017-02-01,"Bill Electronically Reproduced 01/31/2017",https://legiscan.com/MI/bill/HB4129/2017,http://legislature.mi.gov/doc.aspx?2017-HB-4129
938932,1414,HB4130,1,Introduced,2017-01-31,"Public employees and officers; state; state contractors; require to verify legal residency of employees. Creates new act.","Public employees and officers; state; state contractors; require to verify legal residency of employees. Creates new act.",0,,2017-02-01,"Bill Electronically Reproduced 01/31/2017",https://legiscan.com/MI/bill/HB4130/2017,http://legislature.mi.gov/doc.aspx?2017-HB-4130
939007,1414,HB4131,4,Passed,2017-06-07,"Retirement; other; forfeiture of employer contributions to a defined contribution plan if public employee is convicted of certain felonies; provide for. Amends secs. 2, 3 & 4 of 1994 PA 350 (MCL 38.2702 et seq.).","Retirement; other; forfeiture of employer contributions to a defined contribution plan if public employee is convicted of certain felonies; provide for. Amends secs. 2, 3 & 4 of 1994 PA 350 (MCL 38.2702 et seq.).",0,,2017-06-07,"Assigned Pa 43'17 With Immediate Effect",https://legiscan.com/MI/bill/HB4131/2017,http://legislature.mi.gov/doc.aspx?2017-HB-4131
939115,1414,HB4132,1,Introduced,2017-01-31,"Individual income tax; deductions; 3-tier limitations and restrictions on deduction for retirement or pension benefits based on age; eliminate. Amends sec. 30 of 1967 PA 281 (MCL 206.30).","Individual income tax; deductions; 3-tier limitations and restrictions on deduction for retirement or pension benefits based on age; eliminate. Amends sec. 30 of 1967 PA 281 (MCL 206.30).",0,,2017-02-01,"Bill Electronically Reproduced 01/31/2017",https://legiscan.com/MI/bill/HB4132/2017,http://legislature.mi.gov/doc.aspx?2017-HB-4132
939327,1414,HB4133,1,Introduced,2017-01-31,"Criminal procedure; sentencing guidelines; statute of limitations extension for first degree criminal sexual conduct against a child; make retroactive. Amends sec. 24, ch. VII of 1927 PA 175 (MCL 767.24).","Criminal procedure; sentencing guidelines; statute of limitations extension for first degree criminal sexual conduct against a child; make retroactive. Amends sec. 24, ch. VII of 1927 PA 175 (MCL 767.24).",0,,2017-02-01,"Bill Electronically Reproduced 01/31/2017",https://legiscan.com/MI/bill/HB4133/2017,http://legislature.mi.gov/doc.aspx?2017-HB-4133
938880,1414,HB4134,4,Passed,2018-12-28,"Health occupations; physicians; continuing certification requirements for physicians; prohibit as basis for license or renewal. Amends 1978 PA 368 (MCL 333.1101 - 333.25211) by adding sec. 16147.","Health occupations; physicians; continuing certification requirements for physicians; prohibit as basis for license or renewal. Amends 1978 PA 368 (MCL 333.1101 - 333.25211) by adding sec. 16147.",0,,2018-12-28,"Presented To The Governor 12/21/2018 @ 3:00 Pm",https://legiscan.com/MI/bill/HB4134/2017,http://legislature.mi.gov/doc.aspx?2017-HB-4134
939141,1414,HB4135,4,Passed,2018-12-28,"Insurance; health benefits; insurer or health maintenance organization requiring physicians to hold certain certifications before paying or reimbursing claims; prohibit unless specifically required for licensure. Amends 1956 PA 218 (MCL 500.100 - 500.8302) by adding sec. 2212d.","Insurance; health benefits; insurer or health maintenance organization requiring physicians to hold certain certifications before paying or reimbursing claims; prohibit unless specifically required for licensure. Amends 1956 PA 218 (MCL 500.100 - 500.8302) by adding sec. 2212d.",0,,2018-12-28,"Presented To The Governor 12/21/2018 @ 3:02 Pm",https://legiscan.com/MI/bill/HB4135/2017,http://legislature.mi.gov/doc.aspx?2017-HB-4135
941271,1414,HB4136,4,Passed,2017-05-09,"Property tax; delinquent taxes; administration of delinquent tax revolving funds; clarify. Amends secs. 87b & 87f of 1893 PA 206 (MCL 211.87b & 211.87f).","Property tax; delinquent taxes; administration of delinquent tax revolving funds; clarify. Amends secs. 87b & 87f of 1893 PA 206 (MCL 211.87b & 211.87f).",0,,2017-05-09,"Assigned Pa 27'17 With Immediate Effect",https://legiscan.com/MI/bill/HB4136/2017,http://legislature.mi.gov/doc.aspx?2017-HB-4136
941891,1414,HB4137,4,Passed,2017-05-09,"Law enforcement; records; fingerprinting and photographing of child or youth with special health care needs taken and submitted to the automated fingerprint identification system (AFIS) and the statewide network of agency photos upon request of parent or guardian; allow. Amends secs. 2 & 4 of 1985 PA 176 (MCL 722.772 & 722.774).","Law enforcement; records; fingerprinting and photographing of child or youth with special health care needs taken and submitted to the automated fingerprint identification system (AFIS) and the statewide network of agency photos upon request of parent or guardian; allow. Amends secs. 2 & 4 of 1985 PA 176 (MCL 722.772 & 722.774).",0,,2017-05-09,"Assigned Pa 24'17 With Immediate Effect",https://legiscan.com/MI/bill/HB4137/2017,http://legislature.mi.gov/doc.aspx?2017-HB-4137
941288,1414,HB4138,1,Introduced,2017-02-01,"Consumer protection; unfair trade practices; certain pricing practices for credit sales of gasoline; prohibit. Amends sec. 3 of 1976 PA 331 (MCL 445.903).","Consumer protection; unfair trade practices; certain pricing practices for credit sales of gasoline; prohibit. Amends sec. 3 of 1976 PA 331 (MCL 445.903).",0,,2017-02-02,"Bill Electronically Reproduced 02/01/2017",https://legiscan.com/MI/bill/HB4138/2017,http://legislature.mi.gov/doc.aspx?2017-HB-4138
941720,1414,HB4139,1,Introduced,2017-02-01,"Property tax; exemptions; criteria to qualify for property tax exemptions; modify for disabled veterans. Amends sec. 7b of 1893 PA 206 (MCL 211.7b).","Property tax; exemptions; criteria to qualify for property tax exemptions; modify for disabled veterans. Amends sec. 7b of 1893 PA 206 (MCL 211.7b).",0,,2017-02-02,"Bill Electronically Reproduced 02/01/2017",https://legiscan.com/MI/bill/HB4139/2017,http://legislature.mi.gov/doc.aspx?2017-HB-4139
941641,1414,HB4140,1,Introduced,2017-02-01,"Holidays; other; ""Blue Star Mothers Day""; designate as February 1. Creates new act.","Holidays; other; ""Blue Star Mothers Day""; designate as February 1. Creates new act.",0,,2017-02-02,"Bill Electronically Reproduced 02/01/2017",https://legiscan.com/MI/bill/HB4140/2017,http://legislature.mi.gov/doc.aspx?2017-HB-4140
941315,1414,HB4141,1,Introduced,2017-02-01,"Property tax; exemptions; eligible broadband equipment; exempt from personal property tax. Amends 1893 PA 206 (MCL 211.1 - 211.155) by adding sec. 9p.","Property tax; exemptions; eligible broadband equipment; exempt from personal property tax. Amends 1893 PA 206 (MCL 211.1 - 211.155) by adding sec. 9p.",0,,2017-10-18,"Recommendation Concurred In",https://legiscan.com/MI/bill/HB4141/2017,http://legislature.mi.gov/doc.aspx?2017-HB-4141
941344,1414,HB4142,1,Introduced,2017-02-01,"Education; teachers; teacher shortage prevention act; create. Creates new act.","Education; teachers; teacher shortage prevention act; create. Creates new act.",0,,2017-02-02,"Bill Electronically Reproduced 02/01/2017",https://legiscan.com/MI/bill/HB4142/2017,http://legislature.mi.gov/doc.aspx?2017-HB-4142
943555,1414,HB4143,1,Introduced,2017-02-02,"Law enforcement; other; list of qualified volunteers authorized to patrol school premises; require the department of state police to maintain. Amends 1935 PA 59 (MCL 28.1 - 28.16) by adding sec. 15a. TIE BAR WITH: HB 4144'17, HB 4145'17","Law enforcement; other; list of qualified volunteers authorized to patrol school premises; require the department of state police to maintain. Amends 1935 PA 59 (MCL 28.1 - 28.16) by adding sec. 15a. TIE BAR WITH: HB 4144'17, HB 4145'17",0,,2017-02-07,"Bill Electronically Reproduced 02/02/2017",https://legiscan.com/MI/bill/HB4143/2017,http://legislature.mi.gov/doc.aspx?2017-HB-4143
943912,1414,HB4144,1,Introduced,2017-02-02,"Individual income tax; credit; tax credit for certain qualified volunteers; provide for. Amends 1967 PA 281 (MCL 206.1 - 206.713) by adding sec. 277. TIE BAR WITH: HB 4143'17, HB 4145'17","Individual income tax; credit; tax credit for certain qualified volunteers; provide for. Amends 1967 PA 281 (MCL 206.1 - 206.713) by adding sec. 277. TIE BAR WITH: HB 4143'17, HB 4145'17",0,,2017-02-07,"Bill Electronically Reproduced 02/02/2017",https://legiscan.com/MI/bill/HB4144/2017,http://legislature.mi.gov/doc.aspx?2017-HB-4144
943474,1414,HB4145,1,Introduced,2017-02-02,"Education; school districts; qualified volunteer patrol officer on school premises; allow. Amends 1976 PA 451 (MCL 380.1 - 380.1852) by adding sec. 1241. TIE BAR WITH: HB 4143'17, HB 4144'17","Education; school districts; qualified volunteer patrol officer on school premises; allow. Amends 1976 PA 451 (MCL 380.1 - 380.1852) by adding sec. 1241. TIE BAR WITH: HB 4143'17, HB 4144'17",0,,2017-02-07,"Bill Electronically Reproduced 02/02/2017",https://legiscan.com/MI/bill/HB4145/2017,http://legislature.mi.gov/doc.aspx?2017-HB-4145
943594,1414,HB4146,1,Introduced,2017-02-02,"Labor; collective bargaining; requirement for agency fee for nonunion members; allow in bargaining agreements and as condition of employment in public sector. Amends secs. 9, 10 & 15 of 1947 PA 336 (MCL 423.209 et seq.).","Labor; collective bargaining; requirement for agency fee for nonunion members; allow in bargaining agreements and as condition of employment in public sector. Amends secs. 9, 10 & 15 of 1947 PA 336 (MCL 423.209 et seq.).",0,,2017-02-07,"Bill Electronically Reproduced 02/02/2017",https://legiscan.com/MI/bill/HB4146/2017,http://legislature.mi.gov/doc.aspx?2017-HB-4146
943321,1414,HB4147,1,Introduced,2017-02-02,"Labor; collective bargaining; collective bargaining rights; revise to restore former provisions. Amends secs. 1, 2, 8, 14, 17 & 22 of 1939 PA 176 (MCL 423.1 et seq.).","Labor; collective bargaining; collective bargaining rights; revise to restore former provisions. Amends secs. 1, 2, 8, 14, 17 & 22 of 1939 PA 176 (MCL 423.1 et seq.).",0,,2017-02-07,"Bill Electronically Reproduced 02/02/2017",https://legiscan.com/MI/bill/HB4147/2017,http://legislature.mi.gov/doc.aspx?2017-HB-4147
943203,1414,HB4148,2,Engrossed,2017-03-16,"Civil rights; other; freedom of information act exemptions; modify. Amends sec. 13 of 1976 PA 442 (MCL 15.243). TIE BAR WITH: HB 4150'17","Civil rights; other; freedom of information act exemptions; modify. Amends sec. 13 of 1976 PA 442 (MCL 15.243). TIE BAR WITH: HB 4150'17",838,"Senate Government Operations",2017-03-21,"Referred To Committee On Government Operations",https://legiscan.com/MI/bill/HB4148/2017,http://legislature.mi.gov/doc.aspx?2017-HB-4148
944104,1414,HB4149,2,Engrossed,2017-03-16,"Civil rights; other; governor's office; subject to freedom of information act and designate separate part of act. Amends secs. 1 & 2 of 1976 PA 442 (MCL 15.231 & 15.232) & designates pt. 1. TIE BAR WITH: HB 4150'17","Civil rights; other; governor's office; subject to freedom of information act and designate separate part of act. Amends secs. 1 & 2 of 1976 PA 442 (MCL 15.231 & 15.232) & designates pt. 1. TIE BAR WITH: HB 4150'17",838,"Senate Government Operations",2017-03-21,"Referred To Committee On Government Operations",https://legiscan.com/MI/bill/HB4149/2017,http://legislature.mi.gov/doc.aspx?2017-HB-4149
943162,1414,HB4150,2,Engrossed,2017-03-16,"Civil rights; other; legislative open records act (LORA); create as part of the freedom of information act. Amends 1976 PA 442 (MCL 15.231 - 15.246) by adding pt. 2. TIE BAR WITH: HB 4148'17, HB 4149'17, HB 4151'17, HB 4152'17, HB 4153'17, HB 4154'17, HB 4156'17, HB 4157'17","Civil rights; other; legislative open records act (LORA); create as part of the freedom of information act. Amends 1976 PA 442 (MCL 15.231 - 15.246) by adding pt. 2. TIE BAR WITH: HB 4148'17, HB 4149'17, HB 4151'17, HB 4152'17, HB 4153'17, HB 4154'17, HB 4156'17, HB 4157'17",838,"Senate Government Operations",2017-03-21,"Referred To Committee On Government Operations",https://legiscan.com/MI/bill/HB4150/2017,http://legislature.mi.gov/doc.aspx?2017-HB-4150
944141,1414,HB4151,2,Engrossed,2017-03-16,"Civil rights; other; fee for public record search under legislative open records act (LORA); provide for. Amends 1976 PA 442 (MCL 15.231 - 15.246) by adding sec. 54. TIE BAR WITH: HB 4150'17","Civil rights; other; fee for public record search under legislative open records act (LORA); provide for. Amends 1976 PA 442 (MCL 15.231 - 15.246) by adding sec. 54. TIE BAR WITH: HB 4150'17",838,"Senate Government Operations",2017-03-21,"Referred To Committee On Government Operations",https://legiscan.com/MI/bill/HB4151/2017,http://legislature.mi.gov/doc.aspx?2017-HB-4151
943869,1414,HB4152,2,Engrossed,2017-03-16,"Civil rights; other; access to public record search under legislative open records act (LORA); provide for. Amends 1976 PA 442 (MCL 15.231 - 15.246) by adding sec. 55. TIE BAR WITH: HB 4150'17","Civil rights; other; access to public record search under legislative open records act (LORA); provide for. Amends 1976 PA 442 (MCL 15.231 - 15.246) by adding sec. 55. TIE BAR WITH: HB 4150'17",838,"Senate Government Operations",2017-03-21,"Referred To Committee On Government Operations",https://legiscan.com/MI/bill/HB4152/2017,http://legislature.mi.gov/doc.aspx?2017-HB-4152
943400,1414,HB4153,2,Engrossed,2017-03-16,"Public employees and officers; state; designation of legislative open records act (LORA) coordinator; provide for. Amends 1976 PA 442 (MCL 15.231 - 15.246) by adding secs. 56, 57, 58 & 59. TIE BAR WITH: HB 4150'17","Public employees and officers; state; designation of legislative open records act (LORA) coordinator; provide for. Amends 1976 PA 442 (MCL 15.231 - 15.246) by adding secs. 56, 57, 58 & 59. TIE BAR WITH: HB 4150'17",838,"Senate Government Operations",2017-03-21,"Referred To Committee On Government Operations",https://legiscan.com/MI/bill/HB4153/2017,http://legislature.mi.gov/doc.aspx?2017-HB-4153
943279,1414,HB4154,2,Engrossed,2017-03-16,"Civil rights; other; appeal procedure of the legislative open records act (LORA); provide for. Amends 1976 PA 442 (MCL 15.231 - 15.246) by adding secs. 59a & 59b. TIE BAR WITH: HB 4150'17","Civil rights; other; appeal procedure of the legislative open records act (LORA); provide for. Amends 1976 PA 442 (MCL 15.231 - 15.246) by adding secs. 59a & 59b. TIE BAR WITH: HB 4150'17",838,"Senate Government Operations",2017-03-21,"Referred To Committee On Government Operations",https://legiscan.com/MI/bill/HB4154/2017,http://legislature.mi.gov/doc.aspx?2017-HB-4154
943630,1414,HB4155,2,Engrossed,2017-03-16,"Civil rights; other; disclosure of certain legislative open records; provide exemption. Amends 1976 PA 442 (MCL 15.231 - 15.246) by adding secs. 59c & 59d.","Civil rights; other; disclosure of certain legislative open records; provide exemption. Amends 1976 PA 442 (MCL 15.231 - 15.246) by adding secs. 59c & 59d.",838,"Senate Government Operations",2017-03-21,"Referred To Committee On Government Operations",https://legiscan.com/MI/bill/HB4155/2017,http://legislature.mi.gov/doc.aspx?2017-HB-4155
944177,1414,HB4156,2,Engrossed,2017-03-16,"Civil rights; other; separation of material exempt from disclosure; provide for. Amends 1976 PA 442 (MCL 15.231 - 15.246) by adding secs. 59e & 59f. TIE BAR WITH: HB 4150'17","Civil rights; other; separation of material exempt from disclosure; provide for. Amends 1976 PA 442 (MCL 15.231 - 15.246) by adding secs. 59e & 59f. TIE BAR WITH: HB 4150'17",838,"Senate Government Operations",2017-03-21,"Referred To Committee On Government Operations",https://legiscan.com/MI/bill/HB4156/2017,http://legislature.mi.gov/doc.aspx?2017-HB-4156
944027,1414,HB4157,2,Engrossed,2017-03-16,"Legislature; legislative agencies; deciding appeals of public records requests under the legislative open records act (LORA); add to legislative council administrator's duties. Amends sec. 104a of 1986 PA 268 (MCL 4.1104a). TIE BAR WITH: HB 4150'17","Legislature; legislative agencies; deciding appeals of public records requests under the legislative open records act (LORA); add to legislative council administrator's duties. Amends sec. 104a of 1986 PA 268 (MCL 4.1104a). TIE BAR WITH: HB 4150'17",838,"Senate Government Operations",2017-03-21,"Referred To Committee On Government Operations",https://legiscan.com/MI/bill/HB4157/2017,http://legislature.mi.gov/doc.aspx?2017-HB-4157
943829,1414,HB4158,2,Engrossed,2018-05-08,"Criminal procedure; forfeiture; asset forfeiture; require a criminal conviction before proceeding. Amends 1978 PA 368 (MCL 333.1101 - 333.25211) by adding secs. 7521a & 7521b.","Criminal procedure; forfeiture; asset forfeiture; require a criminal conviction before proceeding. Amends 1978 PA 368 (MCL 333.1101 - 333.25211) by adding secs. 7521a & 7521b.",842,"Senate Judiciary",2018-05-10,"Referred To Committee On Judiciary",https://legiscan.com/MI/bill/HB4158/2017,http://legislature.mi.gov/doc.aspx?2017-HB-4158
944063,1414,HB4159,1,Introduced,2017-02-02,"Individual income tax; retirement or pension benefits; limitations and restrictions on deduction for retirement or pension benefits based on taxpayer's age; revise. Amends sec. 30 of 1967 PA 281 (MCL 206.30).","Individual income tax; retirement or pension benefits; limitations and restrictions on deduction for retirement or pension benefits based on taxpayer's age; revise. Amends sec. 30 of 1967 PA 281 (MCL 206.30).",0,,2017-02-07,"Bill Electronically Reproduced 02/02/2017",https://legiscan.com/MI/bill/HB4159/2017,http://legislature.mi.gov/doc.aspx?2017-HB-4159
943125,1414,HB4160,4,Passed,2017-08-16,"Traffic control; traffic regulation; solicitation of contributions in public roadways by certain nonprofit organizations; allow under certain circumstances. Amends sec. 676b of 1949 PA 300 (MCL 257.676b).","Traffic control; traffic regulation; solicitation of contributions in public roadways by certain nonprofit organizations; allow under certain circumstances. Amends sec. 676b of 1949 PA 300 (MCL 257.676b).",0,,2017-08-16,"Assigned Pa 112'17 With Immediate Effect",https://legiscan.com/MI/bill/HB4160/2017,http://legislature.mi.gov/doc.aspx?2017-HB-4160
948544,1414,HB4161,1,Introduced,2017-02-07,"Elections; recounts; provisions regarding election precincts that cannot be recounted; remove. Amends secs. 867, 871, 874 & 881 of 1954 PA 116 (MCL 168.867 et seq.).","Elections; recounts; provisions regarding election precincts that cannot be recounted; remove. Amends secs. 867, 871, 874 & 881 of 1954 PA 116 (MCL 168.867 et seq.).",0,,2017-02-08,"Bill Electronically Reproduced 02/07/2017",https://legiscan.com/MI/bill/HB4161/2017,http://legislature.mi.gov/doc.aspx?2017-HB-4161
948739,1414,HB4162,1,Introduced,2017-02-07,"Townships; public services; townships to create special assessment districts for communications infrastructure including broadband and high-speed internet; allow. Amends secs. 2 & 3 of 1954 PA 188 (MCL 41.722 & 41.723).","Townships; public services; townships to create special assessment districts for communications infrastructure including broadband and high-speed internet; allow. Amends secs. 2 & 3 of 1954 PA 188 (MCL 41.722 & 41.723).",0,,2017-02-08,"Bill Electronically Reproduced 02/07/2017",https://legiscan.com/MI/bill/HB4162/2017,http://legislature.mi.gov/doc.aspx?2017-HB-4162
948596,1414,HB4163,1,Introduced,2017-02-07,"Labor; collective bargaining; calendar and schedule for school year; make prohibited subjects of bargaining. Amends sec. 15 of 1947 PA 336 (MCL 423.215).","Labor; collective bargaining; calendar and schedule for school year; make prohibited subjects of bargaining. Amends sec. 15 of 1947 PA 336 (MCL 423.215).",0,,2017-06-15,"Placed On Third Reading",https://legiscan.com/MI/bill/HB4163/2017,http://legislature.mi.gov/doc.aspx?2017-HB-4163
948517,1414,HB4164,1,Introduced,2017-02-07,"Holidays; other; designation of regular election days in May, August, and November as state holidays; provide for. Amends sec. 1 of 1865 PA 124 (MCL 435.101).","Holidays; other; designation of regular election days in May, August, and November as state holidays; provide for. Amends sec. 1 of 1865 PA 124 (MCL 435.101).",0,,2017-02-08,"Bill Electronically Reproduced 02/07/2017",https://legiscan.com/MI/bill/HB4164/2017,http://legislature.mi.gov/doc.aspx?2017-HB-4164
948938,1414,HB4165,1,Introduced,2017-02-07,"Property tax; exemptions; affidavit filing requirements for disabled veteran exemption; modify. Amends sec. 7b of 1893 PA 206 (MCL 211.7b).","Property tax; exemptions; affidavit filing requirements for disabled veteran exemption; modify. Amends sec. 7b of 1893 PA 206 (MCL 211.7b).",0,,2017-02-08,"Bill Electronically Reproduced 02/07/2017",https://legiscan.com/MI/bill/HB4165/2017,http://legislature.mi.gov/doc.aspx?2017-HB-4165
948646,1414,HB4166,4,Passed,2017-11-09,"Education; employees; provisions providing employment preferences for certain personnel in special education programs and services; repeal. Repeals secs. 1742 & 1743 of 1976 PA 451 (MCL 380.1742 & 380.1743).","Education; employees; provisions providing employment preferences for certain personnel in special education programs and services; repeal. Repeals secs. 1742 & 1743 of 1976 PA 451 (MCL 380.1742 & 380.1743).",0,,2017-11-09,"Assigned Pa 159'17 With Immediate Effect",https://legiscan.com/MI/bill/HB4166/2017,http://legislature.mi.gov/doc.aspx?2017-HB-4166
948391,1414,HB4167,4,Passed,2017-05-23,"Vehicles; trucks; length limit; increase truck and trailer combinations transporting agricultural drainage tubing to 75 feet. Amends sec. 719 of 1949 PA 300 (MCL 257.719).","Vehicles; trucks; length limit; increase truck and trailer combinations transporting agricultural drainage tubing to 75 feet. Amends sec. 719 of 1949 PA 300 (MCL 257.719).",0,,2017-05-23,"Assigned Pa 35'17 With Immediate Effect",https://legiscan.com/MI/bill/HB4167/2017,http://legislature.mi.gov/doc.aspx?2017-HB-4167
949012,1414,HB4168,4,Passed,2018-03-20,"Highways; name; portion of M-71; designate as ""PFC Shane Cantu Veterans Memorial Highway"". Amends 2001 PA 142 (MCL 250.1001 - 250.2080) by adding sec. 1079a.","Highways; name; portion of M-71; designate as ""PFC Shane Cantu Veterans Memorial Highway"". Amends 2001 PA 142 (MCL 250.1001 - 250.2080) by adding sec. 1079a.",0,,2018-03-20,"Assigned Pa 70'18 With Immediate Effect",https://legiscan.com/MI/bill/HB4168/2017,http://legislature.mi.gov/doc.aspx?2017-HB-4168
948696,1414,HB4169,4,Passed,2017-07-12,"Liquor; licenses; prohibition on issuing license within 500 feet of church or school; extend exemption to licenses issued or renewed before certain date. Amends sec. 503 of 1998 PA 58 (MCL 436.1503).","Liquor; licenses; prohibition on issuing license within 500 feet of church or school; extend exemption to licenses issued or renewed before certain date. Amends sec. 503 of 1998 PA 58 (MCL 436.1503).",0,,2017-07-12,"Assigned Pa 66'17 With Immediate Effect",https://legiscan.com/MI/bill/HB4169/2017,http://legislature.mi.gov/doc.aspx?2017-HB-4169
948668,1414,HB4170,4,Passed,2017-11-09,"Health; other; physician orders for scope of treatment forms; allow. Amends sec. 20919 of 1978 PA 368 (MCL 333.20919) & adds pt. 56B & sec. 20192a. TIE BAR WITH: HB 4171'17, HB 4173'17, HB 4174'17","Health; other; physician orders for scope of treatment forms; allow. Amends sec. 20919 of 1978 PA 368 (MCL 333.20919) & adds pt. 56B & sec. 20192a. TIE BAR WITH: HB 4171'17, HB 4173'17, HB 4174'17",0,,2017-11-09,"Assigned Pa 154'17 With Immediate Effect",https://legiscan.com/MI/bill/HB4170/2017,http://legislature.mi.gov/doc.aspx?2017-HB-4170
948467,1414,HB4171,4,Passed,2017-11-09,"Probate; guardians and conservators; physician orders for scope of treatment form; authorize a guardian to sign. Amends secs. 1106, 5303, 5305 & 5314 of 1998 PA 386 (MCL 700.1106 et seq.). TIE BAR WITH: HB 4170'17","Probate; guardians and conservators; physician orders for scope of treatment form; authorize a guardian to sign. Amends secs. 1106, 5303, 5305 & 5314 of 1998 PA 386 (MCL 700.1106 et seq.). TIE BAR WITH: HB 4170'17",0,,2017-11-09,"Assigned Pa 155'17 With Immediate Effect",https://legiscan.com/MI/bill/HB4171/2017,http://legislature.mi.gov/doc.aspx?2017-HB-4171
948866,1414,HB4172,1,Introduced,2017-02-07,"Crimes; vehicle offenses; penalties for installing a nonoperative air bag; provide for. Amends 1931 PA 328 (MCL 750.1 - 750.568) by adding sec. 421d.","Crimes; vehicle offenses; penalties for installing a nonoperative air bag; provide for. Amends 1931 PA 328 (MCL 750.1 - 750.568) by adding sec. 421d.",0,,2017-02-08,"Bill Electronically Reproduced 02/07/2017",https://legiscan.com/MI/bill/HB4172/2017,http://legislature.mi.gov/doc.aspx?2017-HB-4172
948816,1414,HB4173,4,Passed,2017-11-09,"Human services; adult foster care; physician orders for scope of treatment form; establish procedure if adult foster care facility is unwilling to comply with the form. Amends secs. 6 & 26a of 1979 PA 218 (MCL 400.706 & 400.726a) & adds sec. 26c. TIE BAR WITH: HB 4170'17","Human services; adult foster care; physician orders for scope of treatment form; establish procedure if adult foster care facility is unwilling to comply with the form. Amends secs. 6 & 26a of 1979 PA 218 (MCL 400.706 & 400.726a) & adds sec. 26c. TIE BAR WITH: HB 4170'17",0,,2017-11-09,"Assigned Pa 156'17 With Immediate Effect",https://legiscan.com/MI/bill/HB4173/2017,http://legislature.mi.gov/doc.aspx?2017-HB-4173
951429,1414,HB4174,4,Passed,2017-11-09,"Health; emergency response; procedure for complying with a do-not-resuscitate order; revise to reflect physician orders for scope of treatment forms and provide for other general amendments. Amends secs. 2 & 11 of 1996 PA 193 (MCL 333.1052 & 333.1061) & adds sec. 11a. TIE BAR WITH: HB 4170'17","Health; emergency response; procedure for complying with a do-not-resuscitate order; revise to reflect physician orders for scope of treatment forms and provide for other general amendments. Amends secs. 2 & 11 of 1996 PA 193 (MCL 333.1052 & 333.1061) & adds sec. 11a. TIE BAR WITH: HB 4170'17",0,,2017-11-09,"Assigned Pa 157'17 With Immediate Effect",https://legiscan.com/MI/bill/HB4174/2017,http://legislature.mi.gov/doc.aspx?2017-HB-4174
952077,1414,HB4175,1,Introduced,2017-02-08,"Water; quality; drinking water emergency loan fund; create. Amends 1976 PA 399 (MCL 325.1001 - 325.1023) by adding sec. 11e.","Water; quality; drinking water emergency loan fund; create. Amends 1976 PA 399 (MCL 325.1001 - 325.1023) by adding sec. 11e.",0,,2017-02-09,"Bill Electronically Reproduced 02/08/2017",https://legiscan.com/MI/bill/HB4175/2017,http://legislature.mi.gov/doc.aspx?2017-HB-4175
951904,1414,HB4176,4,Passed,2018-08-15,"Vehicles; equipment; use of amber flashing lights on vehicles that participate in neighborhood watch programs; allow. Amends sec. 698 of 1949 PA 300 (MCL 257.698).","Vehicles; equipment; use of amber flashing lights on vehicles that participate in neighborhood watch programs; allow. Amends sec. 698 of 1949 PA 300 (MCL 257.698).",0,,2018-08-15,"Assigned Pa 278'18 With Immediate Effect",https://legiscan.com/MI/bill/HB4176/2017,http://legislature.mi.gov/doc.aspx?2017-HB-4176
951665,1414,HB4177,4,Passed,2017-08-16,"Elections; ballots; requirement of political party vignettes being printed on election ballots; remove. Amends secs. 283, 560a, 570, 685, 696 & 719 of 1954 PA 116 (MCL 168.283 et seq.) & repeals secs. 684 & 775 of 1954 PA 116 (MCL 168.684 & 168.775).","Elections; ballots; requirement of political party vignettes being printed on election ballots; remove. Amends secs. 283, 560a, 570, 685, 696 & 719 of 1954 PA 116 (MCL 168.283 et seq.) & repeals secs. 684 & 775 of 1954 PA 116 (MCL 168.684 & 168.775).",0,,2017-08-16,"Assigned Pa 113'17 With Immediate Effect",https://legiscan.com/MI/bill/HB4177/2017,http://legislature.mi.gov/doc.aspx?2017-HB-4177
951487,1414,HB4178,4,Passed,2017-08-16,"Campaign finance; other; reference to party vignette in the Michigan campaign finance act; remove. Amends sec. 20 of 1976 PA 388 (MCL 169.220). TIE BAR WITH: HB 4177'17","Campaign finance; other; reference to party vignette in the Michigan campaign finance act; remove. Amends sec. 20 of 1976 PA 388 (MCL 169.220). TIE BAR WITH: HB 4177'17",0,,2017-08-16,"Filed With Secretary Of State 7/27/2017 @ 1:06 Pm",https://legiscan.com/MI/bill/HB4178/2017,http://legislature.mi.gov/doc.aspx?2017-HB-4178
951305,1414,HB4179,1,Introduced,2017-02-08,"Local government; financing; safe drinking water revolving fund; authorize use of for replacing lead or galvanized service lines. Amends secs. 5401 & 5403 of 1994 PA 451 (MCL 324.5401 & 324.5403).","Local government; financing; safe drinking water revolving fund; authorize use of for replacing lead or galvanized service lines. Amends secs. 5401 & 5403 of 1994 PA 451 (MCL 324.5401 & 324.5403).",0,,2017-02-09,"Bill Electronically Reproduced 02/08/2017",https://legiscan.com/MI/bill/HB4179/2017,http://legislature.mi.gov/doc.aspx?2017-HB-4179
951251,1414,HB4180,1,Introduced,2017-02-08,"Family law; domestic violence; reference to family independence agency in a certain act; revise to department of health and human services. Amends title & sec. 1 of 1978 PA 389 (MCL 400.1501).","Family law; domestic violence; reference to family independence agency in a certain act; revise to department of health and human services. Amends title & sec. 1 of 1978 PA 389 (MCL 400.1501).",0,,2017-07-12,"Re-referred To Committee On Families, Children, And Seniors",https://legiscan.com/MI/bill/HB4180/2017,http://legislature.mi.gov/doc.aspx?2017-HB-4180
